Daniel_9_1_8000_11560.wav|cuotv seix benx mi ndie mienh
Daniel_9_2_11560_15000.wav|aa haa su e latv nyei dorn
Daniel_9_3_15000_16640.wav|ndaa li atc
Daniel_9_4_16640_22040.wav|liepc zoux ken ndie guoqv nyei hungh daauh hnyangx wuov hnyangx
Daniel_9_5_22040_25800.wav|se ninh zueiz weic gunv da yietv hnyangx
Daniel_9_6_25800_28080.wav|yie ndaa ni en
Daniel_9_7_28080_35600.wav|doqc sou buatc ziouc hiuv duqv ziux ziouv mbuox douc waac mienh ye le mi nyei waac
Daniel_9_8_35600_42600.wav|ye lu saa lem oix zuqc benx ndau huaang buangv cietv ziepc hnyangx
Daniel_9_9_42600_46160.wav|yie ziouc huin mingh lorz ziouv tin hungh
Daniel_9_10_46160_49640.wav|yie zei maiv nyanc haaix nyungc
Daniel_9_11_49640_53040.wav|zuqv jienv la maah ndie cou
Daniel_9_12_53040_58720.wav|aengx zueiz jienv saaiv ndui daux gaux jouh tin hungh
Daniel_9_13_58720_62280.wav|yie daux gaux nyiemc zuiz bun ziouv
Daniel_9_14_62280_64640.wav|yie nyei tin hungh
Daniel_9_15_64640_66520.wav|yie gorngv
Daniel_9_16_66520_68680.wav|o ziouv aac
Daniel_9_17_68680_70360.wav|hlo haic
Daniel_9_18_70360_73520.wav|mbuoqc horngh haic nyei tin hungh
Daniel_9_19_73520_78480.wav|meih ei jienv meih laengz jiex nyei ngaengc waac
Daniel_9_20_78480_86120.wav|yaac ziepc zuoqv nyei hnamv dongh hnamv meih yaac ei meih nyei leiz latc nyei mienh
Daniel_9_40_176800_179760.wav|yie mbuo nyei tin hungh
Daniel_9_41_179760_184160.wav|meih korv lienh aengx guangc yie mbuo nyei zuiz
Daniel_9_42_184160_187080.wav|yie mbuo maiv muangx ziouv
Daniel_9_43_187080_189160.wav|yie mbuo nyei tin hungh nyei waac
Daniel_9_44_189160_191960.wav|dongh meih longc meih nyei bou
Daniel_9_45_191960_196720.wav|zuangx douc waac mienh
Daniel_9_46_196720_200640.wav|jiu bun yie mbuo nyei leiz latc
Daniel_9_47_200640_205480.wav|i saa laa en nyei zuangx mienh baamz meih nyei leiz latc
Daniel_9_48_205480_208920.wav|maiv kangv muangx meih nyei waac
Daniel_9_49_208920_212440.wav|laaix yie mbuo baamz zuiz dorngc meih
Daniel_9_50_212440_216080.wav|yie mbuo ziouc zuqc dongh meih nyei bou
Daniel_9_51_216080_218000.wav|mose
Daniel_9_52_218000_224640.wav|fiev jienv leiz latc sou wuov deix zioux nyei caux houv nyei waac
Daniel_9_53_224640_228080.wav|meih ei jienv meih gorngv nyei waac zoux
Daniel_9_54_228080_233800.wav|ziouc bun yie mbuo caux gunv yie mbuo wuov deix zuqc domh zeqc naanc
Daniel_9_55_233800_240080.wav|yiem lungh ndiev maiv maaih haaix norm dorngx zuqc jiex hnangv ye lu saa lem
Daniel_9_56_240080_243760.wav|hnangv fiev jienv mose nyei leiz latc nor
Daniel_9_57_243760_247840.wav|yie mbuo zuqc naaiv deix yietc zungv zeqc naanc
Daniel_9_58_247840_251440.wav|mv baac yie mbuo corc maiv lorz ziouv
Daniel_9_59_251440_253760.wav|yie mbuo nyei tin hungh
Daniel_9_60_253760_255640.wav|nyei en
Daniel_9_61_255640_260160.wav|huin nzuonx daaih leih nqoi yie mbuo nyei zuiz
Daniel_9_62_260160_263440.wav|ei jienv meih nyei zien leiz zoux
Daniel_9_63_263440_269440.wav|ziouv  liuc leiz ziangx yaac bun yie mbuo zuqc naaiv deix zeqc naanc
Daniel_9_64_269440_271760.wav|weic zuqc ziouv
Daniel_9_65_271760_274120.wav|yie mbuo nyei tin hungh
Daniel_9_66_274120_276280.wav|zoux haaix nyungc
Daniel_9_67_276280_278560.wav|ninh zoux duqv horpc
Daniel_9_68_278560_282960.wav|mv baac yie mbuo corc maiv muangx meih nyei waac
Daniel_9_69_282960_285080.wav|o ziouv
Daniel_9_70_285080_286800.wav|yie mbuo nyei tin hungh aac
Daniel_9_71_286800_295360.wav|meih longc meih henv haic nyei buoz dorh meih nyei baeqc fingx cuotv i yipv deic bung
Daniel_9_72_295360_300000.wav|meih ganh yaac duqv mengh dauh taux ih jaax hnoi
Daniel_9_73_300000_302840.wav|yie mbuo baamz zuiz
Daniel_9_74_302840_305840.wav|yie mbuo zoux orqv sic
Daniel_9_75_305840_307040.wav|o ziouv aac
Daniel_9_76_307040_310800.wav|ziux meih zoux horpc nyei yietc zungv sic
Daniel_9_77_310800_315440.wav|tov guangc nqoi maiv dungx qiex jiez
Daniel_9_78_315440_318760.wav|maiv dungx nouz meih nyei zingh
Daniel_9_79_318760_320520.wav|meih nyei cing nzengc mbong
Daniel_9_80_320520_324120.wav|ye lu saa lem
Daniel_9_81_324120_333920.wav|yie mbuo nyei zuiz caux yie mbuo nyei ong taaix nyei zuiz bun ye lu saa lem caux meih nyei baeqc fingx zuqc weih gormx nyei zuangx mienh huotv
Daniel_9_82_333920_338440.wav|o yie nyei tin hungh aac
Daniel_9_83_338440_343960.wav|ih zanc tov muangx meih nyei bou daux gaux jouh nyei waac
Daniel_9_84_343960_345160.wav|o ziouv aac
Daniel_9_85_345160_352600.wav|tov weic meih ganh bun meih nyei hmien aengv cuotv njang ziux meih nyei singx dinc
Daniel_9_86_352600_357840.wav|se zuqc baaic waaic nyei singx dinc
Daniel_9_87_357840_359640.wav|o yie nyei tin hungh aac
Daniel_9_88_359640_362360.wav|tov baeng m normh muangx
Daniel_9_89_362360_373720.wav|tov nungx nqoi meih nyei m zing mangc yie mbuo zuqc nyei kouv naanc caux gan meih nyei mbuox heuc wuov norm zuqc baaic waaic nyei zingh
Daniel_9_90_373720_381240.wav|yie mbuo daux gaux jouh meih se maiv zeiz weic yie mbuo ganh zoux duqv horpc
Daniel_9_91_381240_385360.wav|se weic meih maaih hnyouv korv lienh
Daniel_9_92_385360_386480.wav|o ziouv aac
Daniel_9_93_386480_389880.wav|tov muangx
Daniel_9_94_389880_391160.wav|o ziouv aac
Daniel_9_95_391160_393400.wav|tov guangc nqoi
Daniel_9_96_393400_398160.wav|tov ziouv muangx haiz yaac zoux aqv
Daniel_9_97_398160_399440.wav|yie nyei tin hungh aac
Daniel_9_98_399440_402840.wav|weih meih ganh maiv dungx ngaih
Daniel_9_99_402840_409160.wav|weic zuqc meih nyei zingh caux meih nyei baeqc fingx gan meih nyei mbuox heuc
Daniel_9_100_409160_414480.wav|gaa mbe li en porv mengh zinh hoz waac
Daniel_9_101_414480_417560.wav|yie daux gaux jienv mingh
Daniel_9_102_417560_423960.wav|nyiemc yie ganh nyei zuiz caux yie juangc i saa laa en fingx nyei mienh nyei zuiz
Daniel_9_103_423960_429400.wav|yaac weic yie nyei tin hungh nyei cing nzengc mbong yiem ziouv
Daniel_9_104_429400_433240.wav|yie nyei tin hungh nyei nza hmien
Daniel_9_105_433240_437320.wav|corc daux gaux jienv wuov zanc
Daniel_9_106_437320_442560.wav|yie buatc dongh zinh ndaangc yiem wuov nzunc laauc yaangh nyei sic wuov dauh mienh
Daniel_9_107_442560_444760.wav|gaa mbe lien
Daniel_9_108_444760_448600.wav|siepv siepv nyei ndaix daaih lorz yie
Daniel_9_109_448600_451600.wav|wuov zanc se lungh maanz hmuangx
Daniel_9_110_451600_454600.wav|fongc horc ziec nyei ziangh hoc
Daniel_9_111_454600_459120.wav|gaa mbe lien gorngv mengh mbuox yie
Daniel_9_112_459120_461000.wav|o ndaa ni en aac
Daniel_9_113_461000_466720.wav|yie ih zanc daaih bun meih maaih cong mengh yaac haih bieqc hnyouv
Daniel_9_114_466720_472600.wav|meih jiez gorn daux gaux jouh wuov zanc tin hungh ziouc dau meih
Daniel_9_115_472600_477640.wav|yie daaih mbuox meih weic zuqc ninh hnamv meih camv nyei
Daniel_9_116_477640_488240.wav|weic naaiv meih oix zuqc longx longx nyei hnamv aengx bieqc hnyouv naaiv deix hinc yaangh nyei sic
Daniel_9_117_488240_500000.wav|tin hungh dingc weic meih nyei baeqc fingx caux meih nyei cing nzengc zingh maaih cietv ziepc norm leiz baaix oix zoux bun baamz zuiz nyei jauv dangx nzengc
Daniel_9_118_500000_500920.wav|nzaaux nzengc
Daniel_9_119_500920_503120.wav|fiqv nzengc zuiz
Daniel_9_120_503120_507320.wav|dorh yietc liuz baengh fim nyei jauv bieqc daaih
Daniel_9_135_586000_591560.wav|yaac maaih zeqc naanc nyei sic ziux dingc ziangx
Daniel_9_136_591560_598480.wav|ninh caux mienh camv liepc jiez yietc norm leiz baaix nyei ngaengc waac
Daniel_9_137_598480_608520.wav|mv baac jiex liuz ndaamv norm leiz baaix ninh oix bun fongc horc caux buov ziec nyei jauv louc dingh
Daniel_9_138_608520_615680.wav|zoux bun nyungc nyungc waaic wuov dauh domh hieh youx ziouc taux aqv
Daniel_9_139_615680_621720.wav|taux dingc daaih nyei setv mueiz dox cuotv bun ninh
