Genesis_2_1_5000_10480|lungh ndau caux maanc muotc hnangv naaiv nor zeix ziangx nzengc aqv
Genesis_2_2_10480_18520|taux da cietv hnoi tin hungh zoux ziangx ninh zoux nyei gong
Genesis_2_3_18520_22320|da cietv hnoi ninh ziouc dingh gong hitv kuonx
Genesis_2_4_22320_28920|tin hungh ceix fuqv da cietv hnoi
Genesis_2_5_28920_34160|bun wuov norm hnoi benx cing nzengc hnoi
Genesis_2_6_34160_40320|weic zuqc ninh zeix lungh zeix ndau nyei gong ziangx
Genesis_2_7_40320_45880|ninh yaac dingh gong hitv kuonx
Genesis_2_8_45880_49360|e nden huingx
Genesis_2_9_49360_55240|zeix lungh zeix ndau nyei jauv louc se hnangv naaiv
Genesis_2_10_55240_61640|ziouv tin hungh zeix lungh zeix ndau wuov zanc
Genesis_2_20_121960_130080|zoux norm huingx yaac bun ninh zeix daaih wuov dauh mienh yiem huingx gu nyuoz
Genesis_2_21_130080_138160|ziouv tin hungh yaac bun nyungc nyungc ndiangx yiem ndau cuotv daaih nzueic nyei
Genesis_2_22_138160_140600|kuh mangc haic
Genesis_2_23_140600_145880|maaih biouv kuv nyei weic zoux nyanc hopv
Genesis_2_24_145880_150400|huingx mbu ndongx maaih i zungh ndiangx
Genesis_2_25_150400_154240|maaih zungh ziangh maengc biouv
Genesis_2_26_154240_156760|maaih zungh aeqv
Genesis_2_27_156760_162680|bun mienh hiuv duqv longx hiuv duqv ciouv nyei biouv
Genesis_2_28_162680_170880|e nden deic bung maaih diuh ndaaih liouc bieqc mingh yungz wuov norm huingx
Genesis_2_39_223400_228760|da feix caax heuc yu fe ditc ndaaih
Genesis_2_40_228760_235400|ziouv tin hungh ziouc bun ninh zeix daaih wuov laanh mienh yiem e nden huingx
Genesis_2_41_235400_240120|bun ninh fioux yaac goux jienv
Genesis_2_42_240120_243120|ziouv hatc ninh
Genesis_2_43_243120_245480|yiem naaiv huingx gu nyuoz
Genesis_2_44_245480_250000|haaix zungh biouv yaac nyanc duqv nyei
Genesis_2_45_250000_255200|mv baac bun mienh hiuv duqv longx hiuv duqv ciouv wuov zungh
Genesis_2_46_255200_258440|cin maanc maiv dungx nyanc
Genesis_2_47_258440_261520|se gorngv meih nyanc nor
Genesis_2_48_261520_265920|dongh wuov hnoi meih za gengh oix zuqc daic aqv
Genesis_2_60_326480_332360|caux ninh zoux doic tengx ninh
Genesis_2_61_332360_337080|ziouv tin hungh ziouc bun wuov dauh mienh bueix m njormh ndo nyei
Genesis_2_62_337080_339760|m njormh mingh wuov zanc
Genesis_2_63_339760_347320|ninh zorqv diuh wuov laanh mienh nyei la saengx mbungv aengx bun orv ziangh ndipc mi aqv
Genesis_2_64_347320_356240|ziouv tin hungh longc yiem m jangc dorn zorqv cuotv wuov diuh la saengx mbungv zoux benx dauh m sieqv dorn
Genesis_2_65_356240_359840|aengx dorh daaih taux m jangc dorn wuov
Genesis_2_66_359840_362920|wuov dauh m jangc dorn ziouc gorngv
Genesis_2_67_362920_365080|dongh naaiv aqv
Genesis_2_68_365080_368240|mbungv yaac yie nyei mbungv benx daaih
Genesis_2_69_368240_371880|orv yaac yie nyei orv benx daaih
Genesis_2_70_371880_376280|oix zuqc tengx ninh cuotv mbuox heuc m sieqv dorn
Genesis_2_71_376280_381360|weic zuqc ninh yiem m jangc dorn cuotv daaih
Genesis_2_72_381360_383800|weic naaiv m jangc dorn dorng jaa
Genesis_2_73_383800_387400|leih ninh nyei diex maac
Genesis_2_74_387400_392480|caux jienv ninh nyei auv gapv daaih
Genesis_2_75_392480_396760|ninh mbuo ziouc benx yietc dauh mi aqv naaiv
Genesis_2_76_396760_402560|dauh m jangc dorn caux ninh nyei auv laengh gaeng nyei yiem mv baac laanh maiv nyaiv laanh
Genesis_3_1_7000_15120|ziouv tin hungh zeix daaih nyei yietc zungv lomc zaangc ga naaiv se naang gauh guaix jiex
Genesis_3_2_15120_18720|naang naaic gaax wuov dauh m sieqv dorn
Genesis_3_3_18720_27760|tin hungh za gengh gorngv maiv bun meih mbuo nyanc yiem naaiv huingx gu nyuoz nyei haaix nyungc biouv fai
Genesis_3_4_27760_31360|wuov dauh m sieqv dorn dau naang
Genesis_3_5_31360_37800|yiem huingx gu nyuoz nyei zungh zungh biouv yie mbuo nyanc duqv nyei
Genesis_3_6_37800_40960|mv baac tin hungh gorngv
Genesis_3_7_40960_47400|yiem huingx mbu ndongx wuov zungh ndiangx nyei biouv cin maanc maiv dungx nyanc
Genesis_3_8_47400_50200|liemh maiv dungx muoqv
Genesis_3_9_50200_51280|maiv zei aeqv
Genesis_3_10_51280_55040|meih mbuo zungv zuqc daic aqv
Genesis_3_11_55040_57800|naang gorngv mbuox m sieqv dorn
Genesis_3_12_57800_60400|meih mbuo maiv daic lorqc
Genesis_3_13_60400_66720|tin hungh hnangv naaiv gorngv weic zuqc ninh hiuv duqv meih mbuo nyanc liuz
Genesis_3_14_66720_69920|meih mbuo haih hnamv duqv tong
Genesis_3_15_69920_73320|meih mbuo ziouc hnangv tin hungh nor
Genesis_3_16_73320_77560|haih hiuv duqv longx hiuv duqv ciouv
Genesis_3_17_77560_83000|wuov dauh m sieqv dorn mangc buatc wuov zungh biouv nzueic nyei
Genesis_3_18_83000_86360|daaix nyanc kuv nyei
Genesis_3_19_86360_91720|ninh yaac hnamv daaih se gorngv haih bun mienh guai nor
Genesis_3_20_91720_94440|za gengh longx haic
Genesis_3_21_94440_97560|ninh ziouc gaeqv daaih nyanc aqv
Genesis_3_22_97560_101360|aengx bun deix ninh nyei nqox nyanc
Genesis_3_23_101360_104240|ninh mbuo nyanc liuz
Genesis_3_24_104240_107280|ninh mbuo haih hnamv duqv tong
Genesis_3_25_107280_111120|ninh mbuo hiuv duqv ganh laengh gaengv nyei yiem
Genesis_3_26_111120_116520|ziouc zorqv ngongh nyorx ndiangx normh lunh daaih pongx jienv aqv
Genesis_3_27_116520_118600|wuov hnoi
Genesis_3_28_118600_121920|lungh maanz hmuangx nyei ziangh hoc
Genesis_3_29_121920_128560|ninh mbuo haiz ziouv tin hungh yiem huingx gu nyuoz yangh jauv
Genesis_3_30_128560_136120|wuov dauh m jangc dorn caux ninh nyei auv ziouc bieqc huingx nyei ndiangx lomc mingh bingx jienv ziouv
Genesis_3_31_136120_140040|mv baac ziouv  tin hungh heuc wuov dauh m jangc dorn
Genesis_3_32_140040_142480|meih yiem haaix laeh
Genesis_3_33_142480_146640|wuov dauh m jangc dorn dau
Genesis_3_34_146640_150600|yie haiz meih yiem naaiv huingx
Genesis_3_35_150600_154720|yie gamh nziex haic weic zuqc yie laengh gaengv nyei yiem ziouc bingx meih
Genesis_3_36_154720_159280|tin hungh naaic gaax
Genesis_3_37_159280_161680|haaix dauh mbuox meih
Genesis_3_38_161680_166400|meih nyei sin laengh gaengv nyei
Genesis_3_39_166400_173160|meih nyanc dongh yie hatc meih maiv dungx nyanc wuov zungh biouv mi aqv saah
Genesis_3_40_173160_176280|wuov dauh m jangc dorn dau
Genesis_3_41_176280_182520|dongh meih bun daaih caux yie yiem naaiv wuov dauh m sieqv dorn
Genesis_3_42_182520_186160|ninh bun naaiv zungh ndiangx nyei biouv yie
Genesis_3_43_186160_189480|yie ziouc nyanc mi aqv
Genesis_3_44_189480_193480|ziouv  tin hungh naaic gaax wuov dauh m sieqv dorn
Genesis_3_45_193480_196600|meih zoux cuotv haaix nyungc sic mi aqv
Genesis_3_46_196600_199720|wuov dauh m sieqv dorn dau
Genesis_3_47_199720_202280|naang ganh nduov yie
Genesis_3_48_202280_203040|yie ziouc nyanc
Genesis_3_49_203040_208160|tin hungh dingc zuiz
Genesis_3_50_208160_211520|ziouv tin hungh mbuox wuov diuh naang
Genesis_3_51_211520_214880|laaix meih hnangv naaiv nor zoux
Genesis_3_52_214880_218320|meih ziouc zuqc houv gauh hniev yietc zungv saeng kuv
Genesis_3_53_218320_223520|gauh camv yietc zungv hieh zoih
Genesis_3_54_223520_228720|meih oix zuqc longc ga sie luih jienv gan ndau mingh
Genesis_3_55_228720_231960|yietc seix oix zuqc nyanc nie mbung
Genesis_3_56_231960_237120|yie oix bun meih caux naaiv dauh m sieqv dorn daav win
Genesis_3_57_237120_242640|yaac bun meih nyei zeiv fun caux ninh nyei zeiv fun zoux win wangv
Genesis_3_58_242640_245000|ninh nyei zeiv fun oix mborqv meih nyei m nqorngv huv
Genesis_3_59_245000_249240|meih yaac oix nyorqv ninh nyei zaux nqo
Genesis_3_60_249240_255760|tin hungh yaac gorngv mbuox wuov dauh m sieqv dorn
Genesis_3_61_255760_260760|maaih sin nyei ziangh hoc yie oix jaa tipv bun meih kouv
Genesis_3_62_260760_264720|ndutv sin nyei ziangh hoc meih oix zuqc mun
Genesis_3_63_264720_269160|mv baac meih corc oix longc meih nyei nqox
Genesis_3_64_269160_270800|meih nyei nqox yaac oix gunv jienv meih
Genesis_3_65_270800_275520|tin hungh yaac gorngv mbuox aa ndam
Genesis_3_66_275520_279280|laaix meih muangx meih nyei auv nyei waac
Genesis_3_67_279280_282240|nyanc dongh yie hatc meih
Genesis_3_68_282240_285560|maiv dungx nyanc wuov zungh biouv
Genesis_3_69_285560_289400|ndau ziouc laaix meih zoux nyei sic zuqc houv
Genesis_3_70_289400_295240|meih yietc seix oix zuqc bangc ndau zoux gong kouv cingx duqv nyanc
Genesis_3_71_295240_299080|ndau oix weic meih cuotv miev cuotv njimv
Genesis_3_72_299080_304520|meih yaac oix zuqc nyanc yiem ndau cuotv nyei lai miev
Genesis_3_73_304520_310160|meih oix zuqc zoux gong kouv cuotv ziex sin hanc wuov deix ndau cingx daaih haih cuotv deix ga naaiv
Genesis_3_74_310160_315200|zoux taux meih aengx nzuonx benx nie
Genesis_3_75_315200_319000|weic zuqc meih se nie benx daaih
Genesis_3_76_319000_321800|meih se nie
Genesis_3_77_321800_326120|meih oix zuqc aengx benx nzunc nie aqv
Genesis_3_78_326120_331040|aa ndam tengx ninh nyei auv cuotv mbuox heuc haawaa
Genesis_3_79_331040_333560|weic zuqc ninh zoux lungh ndiev mienh nyei maa
Genesis_3_80_333560_340400|ziouv tin hungh longc saeng kuv nyei ndopv zoux lui houx bun aa ndam caux ninh nyei auv haawaa zuqv
Genesis_3_81_340400_345440|aa ndam caux haawaa zuqc zunc cuotv huingx
Genesis_3_82_345440_348920|ziouv tin hungh aengx gorngv
Genesis_3_83_348920_353080|ih zanc wuov laanh mienh se hnangv mbuo nor
Genesis_3_84_353080_356840|hiuv duqv longx
Genesis_3_85_356840_359200|hiuv duqv ciouv
Genesis_3_86_359200_365600|oix zuqc maiv dungx bun ninh sung buoz mingh gaeqv ziangh maengc nyei biouv nyanc ziouc yietc liuz duqv ziangh jienv
Genesis_3_87_365600_377560|ziouv tin hungh ziouc zunc ninh cuotv e nden huingx yaac bun ninh zoux liangx ndeic yiem tin hungh longc nanv ninh daaih wuov deix nie
Genesis_3_88_377560_381040|ziouv zunc ninh cuotv liuz
Genesis_3_89_381040_385720|yiem e nden huingx nyei dong bung maengx
Genesis_3_90_385720_389240|ziouv bun ke lu mbim zuov jienv
Genesis_3_91_389240_394160|aengx maaih zung maaih douz nyei nzuqc ndaauv guinh guinh biei bung nyei
Genesis_3_92_394160_399600|dangv jienv mingh ziangh maengc biouv nyei ndiangx wuov diuh jauv
Genesis_4_1_6000_9440|aa ndam caux ninh nyei auv
Genesis_4_2_9440_11080|haawaa
Genesis_4_3_11080_13720|nitv liuz doic
Genesis_4_4_13720_17720|ninh nyei auv ziouc maaih jienv sin aqv
Genesis_4_5_17720_20600|yungz duqv dauh dorn daaih
Genesis_4_6_20600_23000|ninh ziouc gorngv
Genesis_4_7_23000_26120|ziouv tengx yie duqv dauh dorn daaih aqv
Genesis_4_8_26120_28760|ninh ziouc cuotv mbuox heuc kaa in
Genesis_4_9_28760_36280|nqa haav ninh aengx yungz kaa in nyei youz aa mbaen
Genesis_4_15_68640_73160|mv baac kaa in caux ninh fongc horc nyei ga naaiv tin hungh maiv buangv hnyouv aqv
Genesis_4_16_73160_75600|kaa in ziouc qiex jiez haic
Genesis_4_17_75600_81360|hmien mapv maengh mapv hmuangx nyei
Genesis_4_18_81360_84960|ziouv ziouc gorngv mbuox kaa in
Genesis_4_19_84960_87960|meih zoux haaix nyungc qiex jiez
Genesis_4_20_87960_90360|hmien ndongc naaic hmuangx
Genesis_4_21_90360_94560|meih zoux duqv horpc nor yie buangv hnyouv meih
Genesis_4_22_94560_96920|laaix meih zoux maiv horpc
Genesis_4_23_96920_101520|zuiz mbaapv jienv wuov gaengh ndaangc oix gunv jienv meih
Genesis_4_24_101520_104200|mv baac meih oix zuqc borngz taux hingh
Genesis_4_25_104200_109880|kaa in gorngv mbuox ninh nyei youz aa mbaen
Genesis_4_26_109880_113480|mbuo mingh wuov jiex ndeic orqc
Genesis_4_27_113480_114520|mingh taux ndeic
Genesis_4_28_114520_121080|kaa in ziouc caa jienv ninh nyei youz daix guangc mi aqv
Genesis_4_29_121080_123520|ziouv naaic gaax kaa in
Genesis_4_30_123520_126160|meih nyei youz aa mbaen jiex haaix mi aqv
Genesis_4_31_126160_130320|kaa in dau
Genesis_4_32_130320_132720|yie maiv hiuv niaa yie corc oix zuqc goux yie nyei youz fai
Genesis_4_33_132720_136200|ziouv aengx gorngv
Genesis_4_34_136200_141000|meih zoux cuotv haaix nyungc sic
Genesis_4_35_141000_147520|meih nyei youz nyei nziaamv yiem ndau ndiev heuc jienv cuotv daaih gox yie
Genesis_4_36_147520_150480|ih zanc yie houv jienv meih
Genesis_4_37_150480_153760|yangh naaiv jiex meih maiv duqv zoux ndeic
Genesis_4_38_153760_161240|weic zuqc meih longc meih nyei buoz bun meih nyei youz nyei nziaamv liouc njiec saamx bieqc ndau
Genesis_4_39_161240_165240|hnangv ndau morngx nzuih naqv nziaamv nor
Genesis_4_40_165240_170200|yiem naaiv mingh meih zoux ndeic nyei ziangh hoc
Genesis_4_41_170200_173120|ndau maiv cuotv gaeng zuangx
Genesis_4_42_173120_176760|meih oix zuqc zoux njouh huaax mienh youh lungh ndiev
Genesis_4_43_176760_182480|kaa in aengx gorngv mbuox ziouv
Genesis_4_44_182480_188360|meih hnangv naaiv nor dingc yie nyei zuiz se ba laqc hniev haic
Genesis_4_47_194160_197040|guangc jienv naaiv deix ndau mingh
Genesis_4_48_197040_200840|yaac maiv bun yie yiem meih nyei nza hmien
Genesis_4_49_200840_206360|yie oix zuqc zoux njouh huaax mienh jiex naaiv jiex wuov youh lungh ndiev
Genesis_4_50_206360_212640|taux haaix mienh buatc yie ninh mbuo oix daix yie
Genesis_4_51_212640_215480|mv baac ziouv dau
Genesis_4_52_215480_216160|maiv duqv lorqc
Genesis_4_53_216160_223800|haaix dauh daix meih oix zuqc zorqv siec dauh daix div meih yietc dauh
Genesis_4_54_223800_229480|ziouv ziouc zoux norm jangx hoc yiem kaa in nyei sin
Genesis_4_55_229480_233120|haaix dauh buatc ninh ziouc hiuv duqv daix maiv duqv ninh aqv
Genesis_4_56_233120_238200|kaa in ziouc leih nqoi ziouv  mi aqv
Genesis_4_57_238200_241840|mingh e nden dong bung maengx
Genesis_4_58_241840_244480|yiem norm deic bung heuc notv
Genesis_4_59_244480_246040|kaa in nyei zeiv fun
Genesis_4_60_246040_251200|kaa in caux ninh nyei auv nitv liuz doic
Genesis_4_61_251200_254480|ninh nyei auv ziouc maaih sin aqv
Genesis_4_62_254480_258560|yungz duqv dauh dorn yaac cuotv mbuox heuc enokv
Genesis_4_63_258560_267240|kaa in ceix norm zingh daaih cuotv mbuox gan ninh nyei dorn nyei mbuox heuc enokv
Genesis_4_64_267240_272080|enokv duqv dauh dorn heuc i laatv
Genesis_4_65_272080_277400|i laatv zoux me hux yaa en nyei die
Genesis_4_66_277400_283000|me hux yaa en zoux me tu saa en nyei die
Genesis_4_67_283000_287480|me tu saa en zoux laamekv nyei die
Genesis_4_68_287480_290720|laamekv longc i dauh auv
Genesis_4_69_290720_293240|maaih dauh heuc aa ndaa
Genesis_4_70_293240_295840|maaih dauh heuc sinx laa
Genesis_4_71_295840_299600|aa ndaa yungz duqv yaa mbaan
Genesis_4_72_299600_305880|yaa mbaan zoux yiem ndopv liuh yungz saeng kuv wuov deix mienh nyei ong taaix ngaeqv
Genesis_4_73_305880_307000|ninh nyei youz heuc yu mbaan
Genesis_4_74_307000_310000|yu mbaan zoux patv daanh baah
Genesis_4_75_310000_317600|biomv hlauv ndongh nux wuov deix mienh nyei ong taaix ngaeqv
Genesis_4_76_317600_320640|sinx laa yungz duqv tu mban kaa in
Genesis_4_77_320640_325920|tu mban kaa in zoux zaangc mienh
Genesis_4_78_325920_331560|longc dongh siqv caux hlieqv zoux nyungc nyungc jaa sic
Genesis_4_79_331560_334480|ninh nyei muoc heuc naa aa maa
Genesis_4_80_334480_340480|laamekv mbuox ninh nyei auv
Genesis_4_81_340480_344560|aa ndaa caux sinx laa muangx yie gorngv maah
Genesis_4_82_344560_347640|laamekv nyei m sieqv dorn aah
Genesis_4_83_347640_351560|muangx longx yie nyei waac
Genesis_4_84_351560_355720|yie daix dauh mienh weic zuqc ninh hoic yie siang haic
Genesis_4_85_355720_360560|daix dauh mienh lunx mienh weic ninh mborqv yie mun
Genesis_4_86_360560_366440|se gorngv haaix dauh daix kaa in oix zuqc daix siec dauh div nor
Genesis_4_87_366440_370600|haaix dauh daix yie oix zuqc maaih cietv ziepc cietv dauh div
Genesis_4_88_370600_375960|setc caux enotv
Genesis_4_89_375960_378280|aa ndam caux ninh nyei auv nitv liuz doic
Genesis_4_90_378280_382000|ninh nyei auv aengx yungz duqv dauh dorn daaih
Genesis_4_91_382000_384480|ninh nyei auv gorngv
Genesis_4_92_384480_388480|tin hungh aengx bun dauh dorn yie div aa mbaen
Genesis_4_93_388480_392600|dongh kaa in daix wuov dauh
Genesis_4_94_392600_397240|ninh ziouc cuotv mbuox heuc setc
Genesis_4_95_397240_399160|setc yaac duqv dauh dorn
Genesis_4_96_399160_403200|cuotv mbuox heuc enotv
Genesis_4_97_403200_407560|wuov zanc mienh jiez gorn gorngv cuotv ziouv nyei mbuox zaangc ninh
Genesis_5_1_4000_8800|naaiv se aa ndam nyei zeiv fun nyei douh zong daan
Genesis_5_2_8800_12320|tin hungh zeix mienh daaih wuov zanc
Genesis_5_3_12320_15720|ninh zeix daaih zuangv ninh ganh
Genesis_5_15_60000_65080|ninh duqv dauh dorn mbuox heuc enotv
Genesis_5_16_65080_67960|yiem duqv liuz enotv
Genesis_5_17_67960_72360|ninh ziangh duqv betv baeqv lengh siec hnyangx
Genesis_5_18_72360_76800|corc maaih dorn maaih sieqv nyei
Genesis_5_19_76800_81400|setc nyei hnyangx jeiv duqv juov baeqv ziepc nyeic hnyangx
Genesis_5_20_81400_84840|ninh ziouc guei seix mi aqv
Genesis_5_21_84840_89480|enotv duqv juov ziepc hnyangx ninh duqv dauh dorn
Genesis_5_22_89480_92680|mbuox heuc kenan
Genesis_5_23_92680_97160|yiem duqv liuz kenan ninh ziangh duqv betv baeqv ziepc hmz hnyangx
Genesis_5_24_97160_102720|corc maaih dorn maaih sieqv nyei
Genesis_5_25_102720_108360|enotv nyei hnyangx jeiv duqv juov baeqv lengh biaa hnyangx
Genesis_5_26_108360_112440|ninh ziouc guei seix mi aqv
Genesis_5_27_112440_115800|kenan duqv cietv ziepc hnyangx
Genesis_5_28_115800_118440|ninh duqv dauh dorn
Genesis_5_29_118440_122800|mbuox heuc maa haa laa len
Genesis_5_30_122800_125760|duqv liuz maa haa laa len
Genesis_5_31_125760_128800|ninh aengx ziangh duqv betv baeqv feix ziepc hnyangx
Genesis_5_32_128800_132280|corc maaih dorn maaih sieqv nyei
Genesis_5_33_132280_140840|kenan nyei hnyangx jeiv duqv juov baeqv lengh ziepc hnyangx ziouc guei seix mi aqv
Genesis_5_34_140840_145360|maa haa laa len duqv luoqc ziepc hmz hnyangx
Genesis_5_35_145360_147960|ninh duqv dauh dorn
Genesis_5_36_147960_150720|mbuox heuc yaaletv
Genesis_5_37_150720_153040|duqv liuz yaaletv
Genesis_5_38_153040_156040|ninh aengx ziangh duqv betv baeqv faah ziepc hnyangx
Genesis_5_39_156040_161000|corc maaih dorn maaih sieqv nyei
Genesis_5_40_161000_168720|maa haa laa len nyei hnyangx jeiv duqv betv baeqv juov ziepc hmz hnyangx ziouc guei seix mi aqv
Genesis_5_41_168720_173360|yaaletv duqv yietc baeqv luoqc ziepc nyeic hnyangx
Genesis_5_42_173360_177640|ninh duqv dorn mbuox heuc enokv
Genesis_5_43_177640_180440|yiem duqv liuz enokv
Genesis_5_44_180440_182640|ninh aengx ziangh duqv betv baeqv hnyangx
Genesis_5_45_182640_187800|corc maaih dorn maaih sieqv nyei
Genesis_5_46_187800_194560|yaaletv nyei hnyangx jeiv duqv juov baeqv luoqc ziepc nyeic hnyangx ziouc guei seix mi aqv
Genesis_5_47_194560_198120|enokv duqv luoqc ziepc hmz hnyangx
Genesis_5_48_198120_200640|ninh duqv dauh dorn
Genesis_5_49_200640_204400|mbuox heuc me tu se laa
Genesis_5_50_204400_207440|duqv liuz naaiv dauh dorn
Genesis_5_51_207440_211920|enokv caux tin hungh horpc hnyouv jiu tong faam baeqv hnyangx
Genesis_5_52_211920_217280|corc maaih dorn maaih sieqv nyei
Genesis_5_53_217280_223920|enokv nyei siouc nyuonh ziangh duqv faam baeqv luoqc ziepc hmz hnyangx
Genesis_5_54_223920_226960|enokv zanc zanc caux tin hungh jiu tong
Genesis_5_55_226960_229720|tin hungh dorh ninh mingh mi aqv
Genesis_5_56_229720_233880|ziang naaic maiv buatc mi aqv
Genesis_5_57_233880_239400|me tu se laa duqv yietc baeqv betv ziepc cietv hnyangx
Genesis_5_58_239400_243440|ninh duqv dauh dorn mbuox heuc laamekv
Genesis_5_59_243440_245960|yiem duqv liuz laamekv
Genesis_5_60_245960_249320|ninh aengx ziangh duqv cietv baeqv betv ziepc nyeic hnyangx
Genesis_5_61_249320_255440|corc maaih dorn maaih sieqv nyei
Genesis_5_62_255440_264200|me tu se laa nyei hnyangx jeiv duqv juov baeqv luoqc ziepc juov hnyangx ziouc guei seix mi aqv
Genesis_5_63_264200_268440|laamekv duqv yietc baeqv betv ziepc nyeic hnyangx
Genesis_5_64_268440_270320|ninh duqv dauh dorn daaih
Genesis_5_65_270320_275240|tengx ninh cuotv mbuox heuc noyaa
Genesis_5_66_275240_277400|ninh gorngv
Genesis_5_67_277400_280400|weic zuqc ziouv houv ndau
Genesis_5_68_280400_284640|yie mbuo oix zuqc longc buoz zoux gong kouv
Genesis_5_69_284640_290480|naaiv dauh dorn haih tengx yie mbuo nyei gong bou heng deix
Genesis_5_70_290480_293560|laamekv duqv liuz noyaa
Genesis_5_71_293560_299240|ninh aengx ziangh duqv hmz baeqv juov ziepc hmz hnyangx
Genesis_5_72_299240_302960|corc maaih dorn maaih sieqv nyei
Genesis_5_73_302960_310360|laamekv nyei hnyangx jeiv duqv cietv baeqv cietv ziepc cietv hnyangx ziouc guei seix mi aqv
Genesis_5_74_310360_316320|noyaa ziangh duqv hmz baeqv hnyangx cingx duqv buo dauh dorn
Genesis_5_75_316320_319680|mbuox heuc sem haam caux yaafetv
Genesis_6_1_7000_13560|yiem lungh ndiev mienh maanh jiez gorn hiaangx jienv faaux
Genesis_6_2_13560_16680|aengx yungz duqv sieqv
Genesis_6_3_16680_22600|maaih deix doz mienh dorn buatc baamh mienh nyei sieqv nzueic
Genesis_6_4_22600_27640|ninh mbuo yaac ginv deix longc zoux auv
Genesis_6_5_27640_30120|ziouv ziouc gorngv
Genesis_6_6_30120_34720|yie nyei singx lingh maiv caux baamh mienh yietc liuz yiem
Genesis_6_7_34720_37760|ninh mbuo benx orv sin hnangv
Genesis_6_8_37760_45120|yangh naaiv jiex ninh mbuo nyei hnyangx jeiv ziangh duqv taux yietc baeqv nyic ziepc hnyangx
Genesis_6_9_45120_49600|wuov zanc maaih nefin mienh yiem lungh ndiev
Genesis_6_10_49600_53040|nqa haav corc maaih nyei
Genesis_6_11_53040_60640|se doz mienh dorn longc baamh mienh sieqv bun njiec daaih nyei fun faqv
Genesis_6_12_60640_65480|naaiv se loz hnoi maaih banh zeic maaih mengh dauh nyei mienh
Genesis_6_13_65480_71040|ziouv buatc yiem lungh ndiev mienh zoux waaic sic camv
Genesis_6_14_71040_76080|hnyouv haaix zanc kungx hnamv cuotv waaic nyei jauv hnangv
Genesis_6_15_76080_78560|ziouv haiz hnyouv mun haic
Genesis_6_16_78560_80480|hnamv nzuonx
Genesis_6_17_80480_85320|feix duqv ninh maiv dungx zeix mienh maanh daaih yiem lungh ndiev
Genesis_6_18_85320_87840|ninh yaac nzauh haic
Genesis_6_19_87840_89920|ziouv gorngv
Genesis_6_20_89920_92080|yie oix fioux nzengc
Genesis_6_21_92080_95680|guaatv nzengc yie zeix daaih nyei mienh
Genesis_6_22_95680_98520|maiv bun yiem ndau beih
Genesis_6_23_98520_101840|liemh mienh liemh hieh zoih
Genesis_6_24_101840_107280|nyorng ndau nyei ga naaiv caux ndaamv lungh nyei norqc oix mietc nzengc
Genesis_6_25_107280_110160|weic zuqc yie hnamv nzuonx
Genesis_6_26_110160_114280|feix duqv maiv dungx zeix naaiv deix ga naaiv
Genesis_6_27_114280_119040|mv baac noyaa zoux duqv horpc ziouv  nyei hnyouv
Genesis_6_28_119040_123040|yiem naaiv mingh gorngv noyaa nyei jauv louc
Genesis_6_29_123040_124040|noyaa zoux kuv mienh
Genesis_6_30_124040_131240|wuov jaax lungh ndiev kungx ninh ganh maiv maaih dorngx daanh hnangv
Genesis_6_31_131240_135120|ninh haaix zanc yaac gan longx tin hungh
Genesis_6_32_135120_140040|noyaa maaih buo dauh dorn mbuox heuc sem haam caux yaafetv
Genesis_6_33_140040_145640|tin hungh buatc lungh ndiev mienh waaic jienv njiec
Genesis_6_34_145640_148680|mienh kungx zoux doqc zoux orqv nyei sic hnangv
Genesis_6_35_148680_153000|tin hungh mangc lungh ndiev
Genesis_6_36_153000_155320|buatc baaic waaic nzengc
Genesis_6_37_155320_160400|weic zuqc baamh mienh yietc zungv kungx zoux orqv zoux waaic nyei jauv hnangv
Genesis_6_38_160400_166240|tin hungh ziouc gorngv mbuox noyaa
Genesis_6_39_166240_171960|yie dingc hnyouv oix mietc lungh ndiev mienh weic zuqc ninh mbuo zoux orqv sic buangv nzengc lungh ndiev
Genesis_6_40_171960_176680|mangc maah
Genesis_6_41_176680_179000|liemh ninh mbuo
Genesis_6_42_179000_181520|liemh ndau beih
Genesis_6_43_181520_184240|yie oix mietc nzengc
Genesis_6_44_184240_189800|meih oix zuqc longc jiem haic nyei ndiangx gapv poux nzangv
Genesis_6_45_189800_196080|nzangv gu nyuoz oix zuqc nqenx jienv yietc qongx yietc qongx nyei
Genesis_6_46_196080_201600|yaac oix zuqc longc ndau ndiev nyouh haic nyei zung naic jienv gu nyuoz ga nyiec
Genesis_6_47_201600_207640|naaiv poux nzangv oix zuqc hnangv naaiv nor zoux
Genesis_6_48_207640_210040|ndaauv faam baeqv ndorqc
Genesis_6_49_210040_212440|jangv hmz ziepc ndorqc
Genesis_6_50_212440_214920|hlang faah ziepc ndorqc
Genesis_6_51_214920_218520|oix zuqc gomv jienv nzangv liuh
Genesis_6_52_218520_224160|nzangv liuh oix zuqc leih nzangv sin yietc ndorqc hlang
Genesis_6_53_224160_227960|gaengh oix zuqc zoux yiem yietc bung nzangv hlen hnangv
Genesis_6_54_227960_234600|naaiv poux nzangv oix zuqc nqenx zoux buo nzangh
Genesis_6_55_234600_238720|gu nguaaic mbu ndongx caux ga ndiev
Genesis_6_56_238720_244200|mangc maah yie oix bun mbiungc suiv imx yiemx ndau beih
Genesis_6_57_244200_249600|yiemx daic yietc zungv yiem lungh ndiev maaih maengc nyei ga naaiv
Genesis_6_58_249600_252200|da faanh nangh nyei
Genesis_6_59_252200_256520|maaih qiex nyei ga naaiv oix zuqc daic nzengc
Genesis_6_60_256520_261440|mv baac yie oix caux meih laengz jiez ngaengc waac
Genesis_6_61_261440_268360|meih oix zuqc dorh meih nyei auv jueiv dorn mbuangz caux meih bieqc nzangv
Genesis_6_62_268360_274240|meih oix zuqc dorh nyungc nyungc maaih maengc nyei ga naaiv
Genesis_6_63_274240_276680|liemh gouv liemh nyeiz
Genesis_6_64_276680_281480|yietc nyungc yietc doix bieqc nzangv weic caux meih njoux cuotv
Genesis_6_70_304120_309280|liouh jienv zoux meih mbuo nyei nyanc hopv yaac zoux uix saeng kuv nyei ga naaiv
Genesis_6_71_309280_314840|tin hungh hnangv haaix nor paaiv noyaa
Genesis_6_72_314840_317680|noyaa yaac ei jienv zoux nzengc
Isaiah_42_1_10000_14520|yie baav jienv ninh
Isaiah_42_2_14520_18880|yie ginv ninh daaih yaac a hneiv ninh
Isaiah_42_3_18880_23120|yie zorqv yie nyei singx lingh ceix bun ninh
Isaiah_42_4_23120_29600|ninh oix bun maanc guoqv duqv baengh fim nyei leiz
Isaiah_42_30_178920_185760|yie nyei njang laangc yie maiv zorqv bun ganh dauh
Isaiah_42_31_185760_195920|yaac maiv bun longc ceng yie nyei waac ceng diu daaih nyei miuc fangx
Isaiah_42_32_195920_197400|mangc maah
Isaiah_42_33_197400_201600|zinh ndaangc nyei sic jiex mi aqv
Isaiah_42_34_201600_206640|ih zanc yie gorngv siang sic
Isaiah_42_35_206640_215160|naaiv deix sic maiv gaengh cuotv yie ziouc jaa ndaangc gorngv mbuox meih mbuo
Isaiah_42_36_215160_219160|ceng ziouv nyei nzung
Isaiah_42_37_219160_224520|oix zuqc baaux diuh siang nzung ceng ziouv
Isaiah_42_38_224520_229480|jomc lungh ndiev oix zuqc ceng ninh
Isaiah_42_39_229480_237640|mingh koiv nyei mienh caux yietc zungv yiem koiv nyei ga naaiv
