Psalm_86_28_136240_138920|meih zoux nyei gong
Psalm_86_29_138920_142440|maiv maaih haaix nyungc haih beiv duqv
Psalm_86_30_142440_145360|o ziouv aac
Psalm_86_31_145360_152640|meih zeix daaih nyei maanc guoqv maanc fingx oix daaih yiem meih nyei nza hmien gueic njiec baaix
Psalm_86_32_152640_156240|yaac oix ceng meih nyei mengh
Psalm_86_33_156240_160840|weic zuqc meih za gengh hlo haic yaac zoux mbuoqc horngh nyei sic
Psalm_86_34_160840_166480|kungx meih ganh se tin hungh
Psalm_86_35_166480_169960|o ziouv aac
Psalm_86_36_169960_176640|tov meih njaaux yie hiuv duqv meih nyei jauv weic bun yie haih ei meih nyei zien leiz yangh
Psalm_86_37_176640_184320|tov bun yie zunv dingc hnyouv
Psalm_86_38_184320_187920|weic taaih meih nyei mbuox
Psalm_86_39_187920_189000|o ziouv
Psalm_86_40_189000_196400|yie nyei tin hungh aac
Psalm_86_41_196400_202160|yie longc nzengc hnyouv dor ziec meih
Psalm_86_42_202160_208440|yie oix yietc liuz ceng meih nyei mbuox
Psalm_86_43_208440_214840|weic zuqc meih ziepc zuoqv hnamv mienh nyei hnyouv se hlo haic
Psalm_86_44_214840_219160|meih yaac njoux yie
Psalm_86_45_219160_220920|bun yie maiv zuqc mingh yiemh gen
Psalm_86_46_220920_222560|ndo haic nyei dorngx
Psalm_86_47_222560_227400|tin hungh aac
Psalm_86_48_227400_232000|zoux maux nyei mienh cuotv daaih oix hoic yie
Psalm_86_49_232000_240360|maaih guanh mienh doqc mienh oix zorqv yie nyei maengc
Psalm_86_50_240360_246000|ninh mbuo yaac maiv zorqv meih an jienv ninh mbuo nyei nza hmien
Psalm_86_51_246000_249920|mv baac ziouv aac
Psalm_86_52_249920_251520|meih se korv lienh mienh
Psalm_86_53_251520_259960|ceix en bun mienh nyei tin hungh
Psalm_86_54_259960_263040|meih maiv qiex jiez siepv
Psalm_86_55_263040_266920|maaih hnyouv zien zien hnamv mienh
Psalm_86_56_266920_268920|yaac ziepc zuoqv nyei
Psalm_86_57_268920_275120|tov huin nzuonx korv lienh yie
Psalm_86_58_275120_282400|tov ceix meih nyei qaqv bun yie
Psalm_86_59_282400_285720|meih nyei bou
Psalm_86_60_285720_288520|yaac njoux meih nyei m sieqv bou nyei dorn
Psalm_86_61_288520_297080|tov biux mengh meih zoux longx weic bun nzorng yie wuov deix mienh buatc ziouc nyaiv
Psalm_86_62_297080_300000|weic zuqc ziouv aac
Psalm_86_63_300000_304240|meih tengx yie yaac orn yie nyei hnyouv
Psalm_87_1_18000_24600|ziouv  liepc nyei zingh yiem cing nzengc mbong gu nguaaic
Psalm_87_2_24600_28400|ninh hnamv si on nyei zingh gaengh
Psalm_87_3_28400_33480|gauh camv yaakopv yiem nyei norm norm dorngx
Psalm_87_4_33480_38440|o tin hungh nyei zingh aac
Psalm_87_5_38440_45200|mienh nuqv jienv gorngv meih njang laangc nyei jauv
Psalm_87_6_45200_46120|mangc maah
Psalm_87_7_46120_56760|yiem hiuv duqv yie nyei mienh yie lengc jeiv oix tih taux laa hapc caux mbaa mbi lon
Psalm_87_8_56760_63080|fi li saa die caux tailaqv caux jienv e ti o bie
Psalm_87_9_63080_65360|ninh mbuo gorngv
Psalm_87_10_65360_70520|naaiv laanh mienh yiem si on cuotv seix
Psalm_87_11_70520_79160|ninh mbuo oix zorqv si on nyei jauv louc daaih gorngv
Psalm_87_12_79160_85680|naaiv laanh caux wuov laanh yiem naaic cuotv seix
Psalm_87_13_85680_94560|weic zuqc yiem hlang jiex wuov dauh ganh oix liepc naaiv norm zingh
Psalm_87_14_94560_102080|ziouv  faaux maanc fingx nyei mienh hoz daan nyei ziangh hoc ninh fiev jienv
Psalm_87_15_102080_105800|naaiv laanh yiem si on cuotv seix
Psalm_87_16_105800_111600|baaux nzung caux cangx heix nyei mienh oix gorngv
Psalm_87_17_111600_115000|yie nyei yietc zungv wuom zingv yiem meih gu nyuoz
Psalm_89_1_17000_24000|yie oix yietc liuz baaux nzung ceng meih ziepc zuoqv nyei hnamv mienh
Psalm_89_2_24000_35840|yie oix longc yie nyei nzuih zunh meih ziepc zuoqv nyei hnyouv gorngv mbuox yietc doic jiex yietc doic
Psalm_89_3_35840_42520|yie oix gorngv meih oix yietc liuz ziepc zuoqv nyei hnamv mienh
Psalm_89_4_42520_48320|meih maaih ziepc zuoqv nyei hnyouv ndongc lungh wuonv
Psalm_89_5_48320_50200|meih gorngv
Psalm_89_6_50200_56440|yie caux yie ginv daaih nyei mienh liepc jiez ngaengc waac
Psalm_89_7_56440_59120|yie caux yie nyei bou
Psalm_89_8_59120_60440|ndaawitv
Psalm_89_9_60440_63040|houv jienv waac
Psalm_89_10_63040_65200|gorngv
Psalm_89_11_65200_71200|yie oix liepc meih nyei zeiv fun taux yietc liuz
Psalm_89_12_71200_79720|liepc meih nyei hungh weic taux maanc gouv maanc doic
Psalm_89_13_79720_80480|o ziouv aac
Psalm_89_14_80480_87320|tov bun lungh ceng meih zoux wuov deix mbuoqc horngh nyei sic
Psalm_89_15_87320_95280|yaac bun cing nzengc wuov deix yiem gapv zunv nyei dorngx ceng meih ziepc zuoqv nyei hnyouv
Psalm_89_16_95280_100800|yiem wuov lungh maaih haaix dauh haih hnangv ziouv
Psalm_89_17_100800_107440|yiem lungh zaangc wuov deix maaih haaix dauh haih ndongc ziouv
Psalm_89_18_107440_115480|se yiem cing nzengc wuov deix nyei wuic gu nyuoz ninh mbuo taaih nyei tin hungh
Psalm_89_19_115480_123640|yiem weih gormx ninh nyei yietc zungv ninh gauh hlo gauh peix fuc jiex
Psalm_89_20_123640_128040|o nernh jiex nyei ziouv tin hungh aac
Psalm_89_21_128040_132920|maiv maaih haaix dauh ndongc meih henv
Psalm_89_22_132920_135040|o ziouv aac
Psalm_89_23_135040_140480|meih zoux nyei yietc zungv se ziepc zuoqv nyei
Psalm_89_24_140480_145880|meih gunv seix haic nyei koiv
Psalm_89_25_145880_152920|koiv jiez domh laangc meih bun sekv nzengc
Psalm_89_26_152920_159320|meih mborqv huv laa hapc hnangv daix daic nyei mienh
Psalm_89_27_159320_166680|meih longc meih henv haic nyei buoz mborqv meih nyei win wangv nzaanx nzengc
Psalm_89_28_166680_171040|lungh benx meih nyei ndau yaac
Psalm_89_29_171040_173840|meih nyei
Psalm_89_30_173840_182040|baamh gen caux yiem baamh gen nyei maanc muotc meih zeix daaih
Psalm_89_31_182040_184800|naamh bung caux baqv bung meih zeix daaih
Psalm_89_32_184800_196320|taa mbo mbong caux hemon mbong njien youh nyei ceng meih nyei mengh
Psalm_89_33_196320_201480|meih nyei buoz maaih qaqv henv haic
Psalm_89_34_201480_208120|meih nyei mbiaauc jieqv buoz yaac sung faaux hlang
Psalm_89_35_208120_213440|zoux horpc nyei jauv caux baengh fim nyei sic zoux meih nyei weic nyei gorn ndoqv
Psalm_89_36_213440_221600|meih zoux nyei yietc zungv se meih hnamv mienh yaac ziepc zuoqv nyei zoux
Psalm_89_37_221600_226320|o ziouv aac
Psalm_89_38_226320_235240|hiuv duqv njien youh nyei heuc wuov deix mienh maaih orn lorqc
Psalm_89_39_235240_242680|se yiem meih nyei nza hmien nyei njang yangh nyei mienh
Psalm_89_40_242680_249200|ninh mbuo weic meih nyei mbuox ziangh hnoi njien youh
Psalm_89_41_249200_255720|ninh mbuo yaac ceng meih weic meih zoux horpc nyei jauv
Psalm_89_42_255720_260960|meih se ninh mbuo nyei qaqv nyei njang laangc
Psalm_89_43_260960_268080|meih ceix en bun yie mbuo nyei qaqv henv jienv faaux
Psalm_89_44_268080_273480|yie mbuo nyei torngv baaih benx ziouv  nyei
Psalm_89_45_273480_280960|yie mbuo nyei hungh diex guei i saa laa en nyei cing nzengc tin hungh
Psalm_89_46_280960_283000|zinh ndaangc lauh aqv
Psalm_89_47_283000_292040|meih yiem laauc yaangh nyei sic gorngv mbuox meih nyei ziepc zuoqv baeqc fingx
Psalm_89_48_292040_298480|yie bun qaqv yietc dauh mborqv jaax henv nyei mienh
Psalm_89_49_298480_306440|yie yiem baeqc fingx mbu ndongx ginv dauh yaac taaih ninh zoux hlo
Psalm_89_50_306440_308360|yie lorz buatc yie nyei bou
Psalm_89_51_308360_312320|ndaawitv
Psalm_89_52_312320_318720|yaac longc yie nyei cing nzengc youh orn ninh
Psalm_89_53_318720_322480|yie nyei buoz oix liepc ninh wuonv
Psalm_89_54_322480_327200|yaac oix bun qaqv ninh henv
Psalm_89_55_327200_332480|win wangv zungv maiv haih noic maiv duqv ninh
Psalm_89_56_332480_338240|orqv mienh yaac maiv haih bun ninh zuqc baaic
Psalm_89_57_338240_345240|yie oix yiem ninh nyei wuov ndaangc maengx mborqv muonc ninh nyei win wangv
Psalm_89_58_345240_351960|yaac daix nzengc yietc zungv nzorng ninh wuov deix mienh
Psalm_89_59_351960_357920|yie oix hnamv ninh yaac ziepc zuoqv nyei caux ninh yiem
Psalm_89_60_357920_364720|weic yie nyei mengh ninh nyei qaqv oix henv jienv faaux
Psalm_89_61_364720_371600|yie oix bun ninh nyei buoz sung koiv gu nguaaic
Psalm_89_62_371600_378320|ninh nyei mbiaauc jieqv buoz yaac sung ndaaih gu nguaaic
Psalm_89_63_378320_383080|ninh oix heuc jienv mbuox yie
Psalm_89_64_383080_384120|meih se yie nyei die
Psalm_89_65_384120_388320|yie nyei tin hungh
Psalm_89_66_388320_393760|caux bun yie duqv njoux nyei la bieiv
Psalm_89_67_393760_403520|yie oix bun ninh zoux yie nyei dorn la gauv
Psalm_89_68_403520_405680|yiem lungh ndiev zoux gauh hlo jiex nyei hungh
Psalm_89_69_405680_411480|yie oix ziepc zuoqv nyei yietc liuz hnamv ninh
Psalm_89_70_411480_422040|yie caux ninh liepc nyei ngaengc waac yaac yietc liuz wuonv nyei
Psalm_89_71_422040_425240|yie oix liepc ninh nyei hungh douh taux yietc liuz
Psalm_89_72_425240_432280|yaac bun ninh nyei hungh weic ndongc lungh nyei hnoi nyieqc lauh
Psalm_89_73_432280_441360|se gorngv ninh nyei zeiv fun guangc yie nyei leiz latc
Psalm_89_74_441360_442760|maiv gan yie nyei leiz
Psalm_89_75_442760_451520|se gorngv ninh mbuo baamz yie nyei leiz nyeic
Psalm_89_76_451520_456800|yaac maiv gan yie nyei lingc
Psalm_89_77_456800_460600|yie ziouc longc biaav dingc ninh mbuo baamz nyei zuiz
Psalm_89_78_460600_471960|longc biaav bin mborqv weic ninh mbuo zoux dorngc nyei sic
Psalm_89_79_471960_475720|mv baac yie ziepc zuoqv hnamv nyei hnyouv yie maiv zorqv nzuonx
Psalm_89_80_475720_481120|yaac maiv guangc yie ziepc zuoqv zoux nyei jauv
Psalm_89_81_481120_490560|yie maiv bungx ndortv yie laengz nyei ngaengc waac
Psalm_89_82_490560_493040|yaac maiv goiv yie nyei nzuih gorngv cuotv nyei waac
Psalm_89_83_493040_502960|yie ziangv jienv yie nyei cing nzengc mbuox houv nzunc dorngx yietc liuz
Psalm_89_84_502960_512360|yie maiv gorngv baeqc nduov ndaawitv
Psalm_89_85_512360_519040|ninh nyei hungh douh oix yietc liuz yiem
Psalm_89_86_519040_522920|ninh nyei hungh weic oix yiem yie nyei nza hmien ndongc mba hnoi lauh
Psalm_89_87_522920_526400|aengx hnangv hlaax nor
Psalm_89_88_526400_531880|liepc daaih taux yietc liuz
Psalm_89_89_531880_536080|yaac yiem wuonv ndongc lungh lauh
Psalm_89_90_536080_542880|mv baac meih qiex jiez meih longc youh orn daaih wuov dauh ziouc guangc aengx nqemh ninh
Psalm_89_91_542880_549440|meih tuix meih caux meih nyei bou liepc nyei ngaengc waac
Psalm_89_92_549440_554040|meih zorqv ninh nyei hungh ningv zoi njiec nie mbung bun maaih uix
Psalm_89_93_554040_558440|meih caeqv nzengc ninh nyei yietc zungv zingh laatc
Psalm_89_94_558440_566480|bun ninh weih jienv wuonv nyei dorngx baaic waaic nzengc
Psalm_89_95_566480_570640|da faanh jiex jauv nyei mienh caangv ninh nyei ga naaiv
Psalm_89_96_570640_574960|laangz zaangc mienh yaac huotv ninh
Psalm_89_97_574960_577240|meih bun ninh nyei win wangv duqv hingh jiex
Psalm_89_98_577240_581360|bun ninh nyei yietc zungv win jaa njien youh
Psalm_89_99_581360_588840|meih zungv bun ninh nyei nzuqc ndaauv nyei nza hmien mbienv mi aqv
Psalm_89_100_588840_593880|yaac bun ninh yiem mborqv jaax ciangv zuqc suei
Psalm_89_101_593880_595920|meih bun ninh nyei njang laangc zitc nzengc
Psalm_89_102_595920_600440|yaac zorqv ninh nyei hungh weic fongv njiec ndau
Psalm_89_103_600440_606840|meih jamv ninh lunx nyei ziangh hoc zoqc njiec
Psalm_89_104_606840_610440|yaac bun ninh buang hmien diev nyaiv
Psalm_89_105_610440_611280|o ziouv aac
Psalm_89_106_611280_613000|ndongc haaix lauh
Psalm_89_107_613000_619880|meih oix zorqv meih ganh bingx taux yietc liuz fai
Psalm_89_108_619880_623200|meih oix qiex jiez hnangv douz buov jienv taux haaix zanc
Psalm_89_109_623200_625000|o ziouv aac
Psalm_89_110_625000_631120|tov jangx jienv yie nyei maengc ndongc haaix nangv
Psalm_89_111_631120_639800|meih zeix mienh maanh daaih bun ninh mbuo ndongc naaic maiv lamh longc yietc deix
Psalm_89_112_639800_646000|maaih haaix dauh ziangh yaac maiv zuqc daic
Psalm_89_113_646000_652240|fai haaix dauh haih njoux ninh ganh leih ndutv yiemh gen nyei qaqv
Psalm_89_114_652240_655320|ziouv aac
Psalm_89_115_655320_660800|meih zinh ndaangc ziepc zuoqv hnamv nyei hnyouv jiex haaix
Psalm_89_116_660800_667280|se meih ziepc zuoqv nyei caux ndaawitv laengz jiex nyei waac yiem haaix
Psalm_89_117_667280_671800|o ziouv aac
Psalm_89_118_671800_677040|tov jangx jienv meih nyei bou hnangv haaix nor zuqc mienh huotv
Psalm_89_119_677040_690080|yaac jangx jienv yie nyei hnyouv hnangv haaix nor diev maanc mienh ki
Psalm_89_120_690080_691920|o ziouv aac
Psalm_89_121_691920_696040|meih nyei win wangv huotv meih longc youh orn daaih wuov dauh
Psalm_89_122_696040_705480|maiv gunv mingh taux haaix ninh mbuo jatv ninh
Psalm_89_123_705480_707880|oix zuqc ceng ziouv taux yietc liuz
Psalm_89_124_707880_711920|aamen caux aamen
Psalm_91_1_9000_14200|haaix dauh yiem hlang jiex wuov dauh nyei torngv laangh dorngx
Psalm_91_2_14200_17760|se zanx yiem nernh jiex wuov dauh nyei dongh linh gu nyuoz
Psalm_91_3_17760_25080|wuov dauh ziouc gorngv mbuox ziouv
Psalm_91_4_25080_28680|meih se yie ndaauh kaux nyei dorngx
Psalm_91_5_28680_32640|caux weih wuonv nyei dorngx
Psalm_91_6_32640_34640|yie nyei tin hungh
Psalm_91_7_34640_38240|dongh yie kaux wuov dauh
Psalm_91_8_38240_44960|ninh oix njoux meih simv ndutv zaeng norqc mienh nyei koux
Psalm_91_9_44960_49760|caux doqc haic nyei wuon baengc
Psalm_91_10_49760_55960|ninh zungv longc ninh nyei ndaatv gomv jienv meih
Psalm_91_11_55960_64880|yiem ninh nyei ndaatv ga ndiev ziouc bun meih maaih ndaauh kaux nyei dorngx
Psalm_91_12_64880_70400|ninh ziepc zuoqv nyei hnyouv zoux domh torngv baaih
Psalm_91_13_70400_74960|fiuv torngv baaih beu jienv
Psalm_91_14_74960_81760|meih yaac maiv zuqc gamh nziex lungh muonz zanc nyei heiv sic
Psalm_91_15_81760_88920|fai lungh hnoi zanc buonv daaih nyei forng cang
Psalm_91_16_88920_94640|fai lungh muonz zanc daaih nyei domh wuon baengc
Psalm_91_17_94640_102080|fai lungh aanx zanc bun mienh zuqc mietc nyei zeqc naanc
Psalm_91_18_102080_107040|nziex haih maaih yietc cin dauh mienh king njiec meih nyei ga hlen
Psalm_91_19_107040_115840|yietc waanc dauh king njiec meih nyei mbiaauc maengx
Psalm_91_20_115840_122480|mv baac naaiv deix sic maiv daaih nitv fatv meih
Psalm_91_21_122480_131160|meih ganh nyei m zing ziouc mangc buatc winh bun orqv mienh zuqc dingc nyei zuiz
Psalm_91_22_131160_134880|weic zuqc meih bun ziouv
Psalm_91_23_134880_140680|zoux meih ndaauh kaux wuov dauh
Psalm_91_24_140680_145520|se yiem hlang jiex wuov dauh
Psalm_91_25_145520_150800|benx meih yiem nyei dorngx
Psalm_91_26_150800_157920|maiv maaih haaix nyungc ciouv nyei sic ndortv zuqc meih
Psalm_91_27_157920_166520|maiv maaih haaix nyungc siem nyei zeqc naanc daaih nitv fatv meih nyei biauv
Psalm_91_28_166520_173360|weic zuqc tin hungh oix paaiv ninh nyei fin mienh goux jienv meih
Psalm_91_29_173360_179600|beu jienv meih maiv gunv meih mingh taux haaix
Psalm_91_30_179600_185280|ninh mbuo oix longc buoz bouh jienv meih
Psalm_91_31_185280_191280|maiv bun meih nyei zaux zong zuqc la bieiv
Psalm_91_32_191280_196360|meih oix caaiv sienh caux naang jieqv
Psalm_91_33_196360_198920|oix ndamc sienh lunx caux domh naang
Psalm_91_34_198920_205840|tin hungh gorngv
Psalm_91_35_205840_208560|weic zuqc ninh longc hnyouv hnamv yie
Psalm_91_36_208560_212520|yie ziouc dau ninh
Psalm_91_37_212520_216400|yie oix beu jienv ninh
Psalm_91_38_216400_222680|weic zuqc ninh nyiemc yie nyei mbuox
Psalm_91_39_222680_226280|se gorngv ninh heuc yie
Psalm_91_40_226280_230200|yie ziouc dau ninh
Psalm_91_41_230200_237120|ninh buangh zuqc haaix nyungc naanc zingh
Psalm_91_42_237120_238240|yie oix caux ninh yiem
Psalm_91_43_238240_241520|yie oix njoux ninh yaac taaih ninh
Psalm_91_44_241520_249000|yie oix bun ninh buangv eix duqv siouc nyuonh ndaauv
Psalm_91_45_249000_252240|yaac bun ninh buatc yie nyei njoux en
Psalm_93_1_5000_7160|ziouv  zoux hungh
Psalm_93_2_7160_10880|haangh daauh benx ninh nyei zorng zuqv
Psalm_93_3_10880_15440|ziouv zuqv jienv aengx longc domh qaqv sai jienv
Psalm_93_4_15440_18880|baamh gen liepc duqv wuonv
Psalm_93_17_68000_70480|taux maanc gouv maanc doic
Psalm_94_1_8000_12240|o ziouv aac
Psalm_94_2_12240_16480|meih se jaauv win nyei tin hungh
Psalm_94_3_16480_18040|jaauv win nyei tin hungh aah
Psalm_94_4_18040_23480|tov ziux cuotv njang daaih maah
Psalm_94_5_23480_26560|siemv lungh ndiev nyei jien aah
Psalm_94_6_26560_28480|daaih maah
Psalm_94_7_28480_35240|daaih bun zoux maux nyei mienh duqv ziux ninh mbuo horpc zuqc duqv nyei buonc
Psalm_94_8_35240_37440|ziouv aac
Psalm_94_9_37440_41600|orqv mienh oix a hneiv ndongc haaix lauh
Psalm_94_10_41600_44680|oix ndongc haaix lauh
Psalm_94_11_44680_46880|ninh mbuo bungx waac maux
Psalm_94_12_46880_51240|yietc zungv zoux orqv nyei mienh ceng hlo
Psalm_94_13_51240_53400|o ziouv aac
Psalm_94_14_53400_61160|ninh mbuo njiec qaqv zeix meih nyei baeqc fingx yaac hoic meih nzipc nyei buonc
Psalm_94_15_61160_67600|ninh mbuo daix auv guaav caux yiem deic bung nyei ganh fingx mienh
Psalm_94_16_67600_71640|yaac daix guh hanh fu jueiv
Psalm_94_17_71640_74400|ninh mbuo gorngv
Psalm_94_18_74400_77240|ziouv  maiv buatc
Psalm_94_19_77240_81640|yaakopv nyei tin hungh maiv hnamv taux
Psalm_94_20_81640_86120|yiem baeqc fingx mbu ndongx nyei mienh hngongx mienh aah
Psalm_94_21_86120_89680|oix zuqc hiuv aqv
Psalm_94_22_89680_93240|meih mbuo mbanc haic nyei mienh aah
Psalm_94_23_93240_98520|meih mbuo taux haaix zanc cingx guai
Psalm_94_24_98520_100320|tin hungh zeix m normh
Psalm_94_25_100320_103640|ninh ganh muangx maiv haiz fai
Psalm_94_26_103640_105120|ninh zeix m zing
Psalm_94_27_105120_108920|ninh ganh mangc maiv buatc
Psalm_94_28_108920_111760|ninh mborqv njaaux maanc guoqv mienh
Psalm_94_29_111760_115920|ninh maiv zeiz oix dingc ninh mbuo nyei zuiz
Psalm_94_30_115920_118320|ninh njaaux baamh mienh
Psalm_94_31_118320_122880|ninh ganh maiv maaih wuonh zaang fai
Psalm_94_32_122880_129680|ziouv hiuv duqv baamh mienh hnamv nyei sic kungx hnangv tauv yietc nzunc qiex
Psalm_94_33_129680_131920|o ziouv aac
Psalm_94_34_131920_136320|meih mborqv njaaux nyei mienh maaih orn lorqc
Psalm_94_35_136320_140680|se meih longc meih nyei leiz latc njaaux nyei mienh
Psalm_94_36_140680_146920|yiem ninh zuqc kouv nyei hnoi nyieqc meih bun ninh duqv fong deix
Psalm_94_37_146920_152320|zuov wetv ziangx kuotv bun orqv mienh zuqc mietc
Psalm_94_38_152320_157880|weic zuqc ziouv zungv maiv guangc ninh ganh nyei baeqc fingx
Psalm_94_39_157880_162520|ninh maiv leih guangc ninh nzipc daaih nyei buonc
Psalm_94_40_162520_168680|siemv nyei jauv ziouc aengx nzuonx daaih gan baengh fim nyei leiz
Psalm_94_41_168680_173560|yietc zungv hnyouv zingx nyei mienh yaac oix gan
Psalm_94_42_173560_178880|maaih haaix dauh weic yie jiez daaih ngaengc orqv mienh
Psalm_94_43_178880_183880|haaix dauh weic yie ngaengc jienv zoux orqv nyei mienh
Psalm_94_44_183880_187440|se gorngv ziouv  maiv tengx yie
Psalm_94_45_187440_192800|yie zungv siepv siepv nyei mingh yiem sekv nzieqc nyei deic bung
Psalm_94_46_192800_194840|yie gorngv
Psalm_94_47_194840_198240|yie nyei zaux caaiv piatv mi aqv
Psalm_94_48_198240_200520|o ziouv aac
Psalm_94_49_200520_206160|wuov zanc meih ziepc zuoqv nyei hnamv yie ziouc baav jienv yie
Psalm_94_50_206160_210920|yie maaih you nzauh kuonx hnyouv nyei sic camv nyei ziangh hoc
Psalm_94_51_210920_214800|meih orn yie nyei hnyouv bun yie njien youh
Psalm_94_52_214800_220440|waaic haic nyei gunv sic jien haih caux meih jiu tong nyei fai
Psalm_94_53_220440_225640|ninh mbuo longc leiz nyeic zoux waaic nyei sic
Psalm_94_54_225640_234520|ninh mbuo gapv zunv hoic kuv mienh nyei maengc yaac dingc daix maiv zoux dorngc nyei mienh
Psalm_94_55_234520_239160|mv baac ziouv se yie kaux wuonv nyei dorngx
Psalm_94_56_239160_241360|yie nyei tin hungh
Psalm_94_57_241360_245120|se yie ndaauh kaux nyei la bieiv
Psalm_94_58_245120_251320|ninh oix ziux ninh mbuo zoux dorngc nyei zuiz winh bun ninh mbuo
Psalm_94_59_251320_255920|weic ninh mbuo zoux nyei orqv sic mietc ninh mbuo
Psalm_94_60_255920_257440|ziouv
Psalm_94_61_257440_259560|yie mbuo nyei tin hungh
Psalm_94_62_259560_262200|oix mietc nzengc ninh mbuo
Psalm_95_2_5880_11200|daaih maah mbuo oix zuqc daaih baaux nzung ceng ziouv
Psalm_95_3_11200_17960|mbuo njien youh nyei heuc jienv ceng njoux yie mbuo nyei la bieiv
Psalm_95_4_17960_22840|mbuo oix zuqc daaih yiem ninh nyei nza hmien dor ziec ninh
Psalm_95_5_22840_27760|yaac oix zuqc njien youh nyei heuc jienv baaux nzung ceng ninh
Psalm_95_6_27760_31920|weic zuqc ziouv se hlo haic nyei tin hungh
Psalm_95_7_31920_34640|yaac zoux domh hungh diex
Psalm_95_8_34640_38280|gauh hlo jiex maanc zienh
Psalm_95_9_38280_43400|ndau ndiev ndo jiex nyei dorngx yiem ninh nyei buoz gu nyuoz
Psalm_95_10_43400_47600|hlang jiex nyei mbong yaac benx ninh nyei
Psalm_95_11_47600_49800|koiv benx ninh nyei
Psalm_95_12_49800_53360|weic zuqc ninh ganh zeix daaih
Psalm_95_13_53360_57240|ninh nyei buoz zeix cuotv ndau beih
Psalm_95_14_57240_58560|daaih maah
Psalm_95_15_58560_61960|mbuo oix zuqc puoqv njiec baaix ninh
Psalm_95_16_61960_67680|mbuo oix zuqc gueic njiec zeix mbuo daaih wuov dauh ziouv  nyei nza hmien
Psalm_95_17_67680_71720|weic zuqc ninh benx mbuo nyei tin hungh
Psalm_95_18_71720_76800|mbuo se ninh nyei miev ciangv nyei baeqc fingx
Psalm_95_19_76800_78960|yiem ninh nyei buoz ndiev nyei ba gi yungh
Psalm_95_20_78960_84520|tov meih mbuo ih hnoi muangx ninh nyei qiex
Psalm_95_21_84520_90280|maiv dungx zoux hnyouv ngaengc hnangv zinh ndaangc yiem me li mbaa
Psalm_95_22_90280_93160|yaac hnangv yiem deic bung huaang
Psalm_95_23_93160_94960|matv saax
Psalm_95_24_94960_96960|wuov hnoi nor
Psalm_95_25_96960_102400|wuov zanc meih mbuo nyei ong taaix seix yie yaac cuoqv yie
Psalm_95_26_102400_106720|maiv gunv ninh mbuo buatc yie zoux nyei sic
Psalm_95_27_106720_111520|feix ziepc hnyangx gu nyuoz yie nouz haic naaic doic mienh
Psalm_95_28_111520_112960|yie gorngv
Psalm_95_29_112960_117360|ninh mbuo benx yietc fingx hnyouv maiv zingx nyei mienh
Psalm_95_30_117360_121560|ninh mbuo yaac maiv bieqc hnyouv yie nyei jauv
Psalm_95_31_121560_126440|weic naaiv yie qiex jiez ziouc houv jienv gorngv
Psalm_95_32_126440_130320|ninh mbuo yietc liuz maiv duqv bieqc yie nyei hitv kuonx dorngx
Psalm_96_1_6000_12040|oix zuqc baaux diuh siang nzung bun ziouv
Psalm_96_2_12040_16720|lungh ndiev oix zuqc baaux nzung bun ziouv
Psalm_96_3_16720_19120|baaux nzung bun ziouv
Psalm_96_4_19120_21960|baaux ceng ninh nyei mengh
Psalm_96_5_21960_26360|hnoi hnoi zunh yaangh ninh nyei njoux en
Psalm_96_6_26360_30440|yiem maanc guoqv zunh yaangh ninh nyei njang laangc
Psalm_96_7_30440_36680|yiem maanc fingx mbu ndongx gorngv ninh zoux mbuoqc horngh nyei sic
Psalm_96_8_36680_39480|weic zuqc ziouv se hlo haic
Psalm_96_9_39480_43560|horpc zuqc camv camv nyei ceng
Psalm_96_10_43560_48200|oix zuqc taaih ninh gauh camv maanc zienh
Psalm_96_11_48200_54480|weic zuqc zuangx fingx nyei yietc zungv zienh benx miuc fangx hnangv
Psalm_96_12_54480_57960|mv baac ziouv  zeix lungh
Psalm_96_13_57960_63960|maaih njang laangc caux haangh daauh yiem ninh nyei nza hmien
Psalm_96_14_63960_70160|yiem ninh nyei singx dinc bun cing ninh maaih qaqv yaac nzueic haic
Psalm_96_15_70160_72840|o maanc fingx mienh aah
Psalm_96_16_72840_75400|oix zuqc ceng ziouv
Psalm_96_17_75400_80000|oix zuqc ceng ziouv nyei njang laangc caux qaqv
Psalm_96_18_80000_84600|oix zuqc ceng ziouv puix ninh njang laangc nyei mbuox
Psalm_96_19_84600_92000|dorh fongc horc nyei ga naaiv daaih bieqc ninh nyei singx dinc nyei laatc gu nyuoz
Psalm_96_20_92000_97920|zaangc ziouv nyei ziangh hoc oix zuqc zuqv cing nzengc nyei lui houx
Psalm_96_21_97920_100200|lungh ndiev mienh aah
Psalm_96_22_100200_104560|oix zuqc sin zinx jienv yiem ziouv  nyei nza hmien
Psalm_96_23_104560_107960|yiem maanc guoqv mbu ndongx oix zuqc gorngv
Psalm_96_24_107960_109840|ziouv  zoux hungh
Psalm_96_25_109840_112680|baamh gen liepc duqv wuonv
Psalm_96_26_112680_116520|maiv maaih haaix nyungc haih ndanc duqv dongz
Psalm_96_27_116520_120600|ninh yaac oix baengh fim nyei siemv maanc fingx
Psalm_96_28_120600_122160|lungh aah
Psalm_96_29_122160_124720|oix zuqc njien youh
Psalm_96_30_124720_126360|ndau aah
Psalm_96_31_126360_127280|oix zuqc orn lorqc
Psalm_96_32_127280_134560|koiv caux yiem koiv nyei yietc zungv ga naaiv oix zuqc zoz zoz nyei mbui
Psalm_96_33_134560_140280|lingh deic caux yiem lingh deic gu nyuoz nyei yietc zungv ga naaiv
Psalm_96_34_140280_143720|oix zuqc njien youh a hneiv
Psalm_96_35_143720_150640|wuov zanc lomc zaangc nyei yietc zungv ndiangx ziouc njien youh nyei baaux nzung
Psalm_96_36_150640_153240|yiem ziouv nyei nza hmien
Psalm_96_37_153240_156960|weic zuqc ninh oix daaih siemv lungh ndiev
Psalm_96_38_156960_160560|ninh oix baengh fim nyei siemv baamh gen
Psalm_96_39_160560_163760|yaac longc ninh nyei zien leiz siemv maanc fingx
Psalm_98_1_0_8160|oix zuqc baaux diuh siang nzung ceng ziouv  weic zuqc ninh zoux mbuoqc horngh nyei sic
Psalm_98_2_8160_12760|ninh nyei mbiaauc jieqv buoz caux cing nzengc qaqv
Psalm_98_3_12760_15840|bun ninh duqv hingh jiex
Psalm_98_4_15840_23160|ziouv bun mienh hiuv duqv ninh hingh jiex ninh bun maanc fingx hiuv duqv ninh baengh fim nyei
Psalm_98_5_23160_31320|ninh jangx taux ninh weic i saa laa en mienh maaih ziepc zuoqv nyei hnyouv yaac hnamv ninh mbuo
Psalm_98_6_31320_37200|gormx lungh ndiev duqv buatc mbuo nyei tin hungh duqv hingh jiex
Psalm_98_7_37200_39400|lungh ndiev mienh aah
Psalm_98_8_39400_42960|oix zuqc njien youh nyei heuc jienv ceng ziouv
Psalm_98_9_42960_47440|cuotv qiex njien youh nyei baaux nzung ceng ninh
Psalm_98_10_47440_52280|patv daanh baah baaux nzung ceng ziouv
Psalm_98_11_52280_57200|longc daanh baah patv puix nzung nyei sing qiex
Psalm_98_12_57200_59720|longc nzatc caux jorng nyei qiex
Psalm_98_13_59720_66000|cuotv njien youh nyei qiex mbui fungx bun ziouv
Psalm_98_14_66000_70240|mbuo nyei hungh diex koiv caux
Psalm_98_15_70240_73400|yiem koiv nyei ga naaiv
Psalm_98_16_73400_80440|lungh ndiev caux yiem lungh ndiev nyei ga naaiv oix zuqc cuotv qiex mbui
Psalm_98_17_80440_83680|bun zuangx ndaaih mbaix ninh mbuo nyei
Psalm_98_18_83680_90000|buoz zuangx mbong oix zuqc lomh nzoih njien youh nyei baaux nzung
Psalm_98_19_90000_93520|yiem ziouv  nyei nza hmien
