Daniel_6_85_407280_412560|yie yaac yiem meih nyei nza hmien maiv zoux dorngc haaix nyungc
Daniel_6_86_412560_419600|hungh diex za gengh a hneiv haic ziouc paaiv mienh zorqv ndaa ni en yiem kuotv cuotv daaih
Daniel_6_87_419600_423160|ninh mbuo ziouc zorqv ninh cuotv daaih
Daniel_6_88_423160_430600|buatc ninh nyei sin zaangc maiv maaih yietc norm dorngx mun weic zuqc ninh sienx kaux ninh nyei tin hungh
Daniel_6_89_430600_435480|hungh diex ziouc hatc mienh zorqv gox ndaa ni en wuov deix mienh
Daniel_6_90_435480_439360|liemh ninh mbuo nyei auv caux naamh nyouz
Daniel_6_91_439360_441840|zorqv ninh mbuo zoi njiec sienh nyei kuotv
Daniel_6_92_441840_446760|ndortv njiec zungv maiv taux kuotv ndoqv
Daniel_6_93_446760_449600|sienh ziouc betv ninh mbuo
Daniel_6_94_449600_454960|bun ninh mbuo nyei mbungv nauv muonc nzengc
Daniel_6_95_454960_461560|nqa haav ndaa li atc hungh fungx fienx tong lungh ndiev maanc guoqv
Daniel_6_96_461560_462480|maanc fingx
Daniel_6_97_462480_466040|maanc nyungc waac nyei mienh
Daniel_6_98_466040_466920|ninh gorngv
Daniel_6_99_466920_471040|tov bun meih mbuo yietc zungv duqv baengh orn
Daniel_6_100_471040_482120|yie njiec lingc gorngv da faanh yie gunv nyei guoqv nyei yietc zungv baeqc fingx oix zuqc gamh nziex yaac oix zuqc taaih ndaa ni en nyei tin hungh
Daniel_7_20_97902_101680|gunv nyanc orv camv camv nyei
Daniel_7_21_101578_104080|nqa haav yie mangc
Daniel_7_22_103975_108640|aengx buatc dauh ga naaiv hnangv domh nda maauh mbeux
Daniel_7_23_108531_114720|ninh nyei diqc daanz maaih biei kuaaiv ndaatv hnangv norqc nyei ndaatv nor
Daniel_7_24_114605_119080|naaiv dauh ga naaiv maaih biei norm m nqorngv
Daniel_7_25_118960_122360|ninh yaac duqv zipv lingc gunv
Daniel_7_26_122237_127840|jiex daaih yiem yie buatc laauc yaangh nyei sic wuov muonz
Daniel_7_27_127712_131760|yie mangc ziouc buatc da feix dauh ga naaiv
Daniel_7_28_131628_134360|se doqc haic
Daniel_7_29_134225_138160|gamh nziex haic yaac henv haic
Daniel_7_30_138021_141440|ninh maaih domh hlieqv nyaah
Daniel_7_31_141298_146360|ninh betv aengx ngaatc muonc ninh zorqv nyei ga naaiv
Daniel_7_32_146213_150400|zengc wuov deix longc zaux caaiv jienv
Daniel_7_33_150249_154920|ninh caux cuotv ndaangc wuov deix maiv fih hnangv
Daniel_7_34_154765_158680|ninh yaac maaih ziepc norm jorng
Daniel_7_35_158521_164120|yie mangc jienv aengx hnamv taux naaiv deix jorng nyei ziangh hoc
Daniel_7_36_163955_168640|yie buatc norm jorng faix nyei yiem naaiv deix jorng mbu ndongx cuotv daaih
Daniel_7_37_168471_177160|cuotv ndaangc wuov deix jorng maaih buo norm dorng jienv ninh liemh gorn baeng cuotv nzengc
Daniel_7_38_176982_180120|naaiv norm jorng faix
Daniel_7_39_179939_186520|maaih m zing hnangv mienh nyei m zing yaac maaih nzuih baengx bungx waac maux
Daniel_7_40_186333_190000|mangc buatc yietc liuz ziangh wuov dauh
Daniel_7_41_189810_191800|yie mangc jienv wuov zanc
Daniel_7_42_191608_195000|buatc maaih ziex norm weic liepc jiez
Daniel_7_43_194805_202360|aengx maaih yietc liuz ziangh wuov dauh daaih zueiz ninh nyei weic
Daniel_7_44_202157_206880|ninh nyei lui mbopv baeqc hnangv sorng nor
Daniel_7_45_206673_212040|ninh nyei mba biei hnangv cing nzengc ba gi yungh nyei biei
Daniel_7_46_211827_217320|ninh nyei weic hnangv maaih douz mbietc zieqc jienv nyei
Daniel_7_47_217102_223400|weic nyei yienh yaac hnangv maaih douz zieqc jienv nyei nor
Daniel_7_48_223176_227560|yiem ninh nyei nza hmien maaih douz njopc cuotv
Daniel_7_49_227332_230680|liouc mingh hnangv ndoqv nor
Daniel_7_50_230449_234120|cin cin dauh fu sux ninh
Daniel_7_51_233885_238480|waanc waanc dauh souv jienv ninh nyei nza hmien
Daniel_7_52_238241_244080|siemv zuiz jien zueiz jienv weic oix siemv zuiz
Daniel_7_53_243835_248360|zuangx sou daan yaac koi nqoi nzengc
Daniel_7_54_248111_254800|wuov zanc yie mangc jienv weic zuqc wuov norm jorng faix bungx waac maux
Daniel_7_55_254545_259560|mangc jienv wuov zanc wuov dauh hieh ga naaiv zuqc daix daic
Daniel_7_56_259300_263720|ninh nyei sin sei zuqc jiu bun douz buov mietc nzengc
Daniel_7_57_263456_268280|zengc njiec wuov deix hieh ga naaiv
Daniel_7_58_268011_272000|ninh mbuo nyei lingc zuqc zorqv mi aqv
Daniel_7_59_271728_279160|mv baac ninh mbuo nyei maengc liouh jienv weic dingc ziangx nyei hnoi nyieqc caux ziangh hoc
Daniel_7_60_278880_284360|yiem lungh muonz zanc mangc jienv wuov deix hinc yaangh nyei sic wuov zanc
Daniel_7_61_284075_285040|yie mangc
Daniel_7_62_284754_291720|buatc maaih dauh hnangv dauh mienh caux jienv lungh nyei mbuonx daaih
Daniel_7_63_291428_298360|ninh daaih lorz yaac duqv mingh yiem yietc liuz ziangh wuov dauh nyei nza hmien
Daniel_7_64_298061_305720|ninh duqv zipv lingc gunv yaac duqv njang laangc caux hungh lingc weic bun maanc guoqv
Daniel_7_65_305414_307840|maanc fingx
Daniel_8_10_53840_57680|i norm jorng zungv ndaauv nyei
Daniel_8_11_57680_61240|mv baac maaih norm gauh ndaauv
Daniel_8_12_61240_64920|gauh ndaauv wuov norm nqa haav cuotv
Daniel_8_13_64920_70680|yie buatc wuov dauh ba gi yungh gouv ceux mingh fai bung
Daniel_8_14_70680_74400|baqv bung caux naamh bung
Daniel_8_15_74400_80160|maiv maaih haaix nyungc hieh zoih haih borngz duqv ninh hingh
Daniel_8_16_80160_85520|yaac maiv maaih haaix dauh tengx biaux ndutv ninh nyei qaqv
Daniel_8_17_85520_91560|ninh sueih ganh nyei hnyouv zoux yaac zoux hlo jienv faaux
Daniel_8_18_91560_97000|yie yiem hnyouv hnamv taux naaiv deix jauv nyei ziangh hoc
Daniel_8_19_97000_106520|buatc maaih dauh yungh gouv yiem fai bung gan lungh ndiev nyei ndau beih daaih mv baac zaux zungv maiv taux ndau
Daniel_8_20_106520_113800|wuov dauh yungh gouv maaih jorng yiem i norm m zing mbu ndongx nqaengc nyei
Daniel_8_30_164920_171080|mv baac henv nyei ziangh hoc ninh nyei domh jorng zuqc nauv mi aqv
Daniel_8_31_171080_177320|yiem jorng nyei gorn aengx cuotv biei norm jorng nqaengc nyei
Daniel_8_32_177320_181400|hungx lungh nyei biei bung nziaaux
Daniel_8_33_181400_188120|naaiv deix biei norm jorng nyei yietc norm aengx cuotv norm jorng dorn
Daniel_8_34_188120_191880|naaiv norm jorng za gengh zoux hlo
Daniel_8_35_191880_194320|henv jienv faaux
Daniel_8_40_215320_218280|ninh taaih ninh ganh zoux hlo
Daniel_8_41_218280_223560|zungv ndongc lungh zaangc nyei jun baeng nyei hungh dorn
Daniel_8_42_223560_230920|ninh maiv bun mienh hnoi hnoi fongc horc buov ziec yaac baaic waaic hungh dorn nyei singx dinc
Daniel_8_43_230920_233360|laaix zuiz nyei gorn
Daniel_8_44_233360_241160|lungh zaangc nyei jun baeng caux hnoi hnoi buov ziec nyei jauv zuqc jiu bun ninh
Daniel_8_45_241160_245320|ninh zorqv zien leiz zoi njiec ndau
Daniel_8_46_245320_250400|ninh zoux jienv mingh yaac duqv longx jienv faaux
Daniel_8_47_250400_256320|nqa haav yie haiz dauh cing nzengc nyei fin mienh gorngv waac
Daniel_8_48_256320_262600|aengx maaih ganh dauh cing nzengc nyei fin mienh daaih naaic gorngv waac wuov dauh
Daniel_8_49_262600_268120|buatc yiem naaiv deix hinc yaangh nyei sic oix cuotv ndongc haaix lauh
Daniel_8_50_268120_270920|guangc hnoi hnoi fongc horc buov ziec nyei ga naaiv
Daniel_8_51_270920_277960|caux mienh baamz zuiz cuotv baaic waaic nyei sic ndongc haaix lauh
Daniel_8_52_277960_287880|singx dinc caux lungh zaangc nyei jun baeng oix zuqc jiu mingh zuqc caaiv njiec ndau ndongc haaix lauh
Daniel_8_53_287880_290320|ninh gorngv mbuox yie
Daniel_8_54_290320_294840|oix zuqc maaih i cin faam baeqv hnoi
Daniel_8_55_294840_301160|singx dinc cingx aengx nzuonx daaih hnangv loz wuov nor cing nzengc
Daniel_8_56_301160_305480|gaa mbe lien porv mengh laauc yanngh nyei sic
Daniel_8_57_305480_308080|yie ndaa ni en
Daniel_8_58_308080_312320|buatc liuz naaiv deix hinc yaangh nyei sic
Daniel_8_59_312320_316000|yie gengh oix mengh baeqc eix leiz
Daniel_8_60_316000_318640|liemh zeih maaih dauh
Daniel_8_61_318640_321640|fangx zeiv hnangv mienh nor
Daniel_8_62_321640_325360|souv jienv yie nyei nza hmien
Daniel_8_63_325360_331680|yie yaac haiz dauh mienh nyei qiex yiem ulai ndaaih i bung mbu ndongx
Daniel_8_64_331680_334080|heuc jienv gorngv
Daniel_8_65_334080_336720|gaa mbe lien aac
Daniel_8_66_336720_342880|oix zuqc bun naaiv dauh mienh bieqc hnyouv naaiv deix hinc yaangh nyei sic
Daniel_8_67_342880_348720|gaa mbe lien ziouc daaih nitv jienv yie souv nyei dorngx
Daniel_8_68_348720_351120|ninh yietv daaih
Daniel_8_69_351120_352520|yie gamh nziex haic
Daniel_8_70_352520_357440|ziouc mbaapv njiec hmien taux ndau
Daniel_8_71_357440_360040|ninh gorngv mbuox yie
Daniel_8_72_360040_363280|o baamh mienh nyei dorn aac
Daniel_8_73_363280_370600|oix zuqc bieqc hnyouv naaiv deix hinc yaangh nyei sic se weic setv mueiz nyei hnoi nyieqc
Daniel_8_74_370600_373960|ninh caux yie gorngv waac nyei ziangh hoc
Daniel_8_75_373960_377000|yie m njormh ndo nyei
Daniel_8_76_377000_379440|hmien taux ndau
Daniel_8_77_379440_383880|mv baac ninh maan yie aengx ken yie jiez sin souv jienv
Daniel_8_78_383880_387200|ninh gorngv
Daniel_8_79_387200_389280|muangx maah
Daniel_8_80_389280_392520|yie oix bun meih hiuv duqv tin hungh nouz mienh
Daniel_8_81_392520_396240|setv mueiz nyei hnoi nyieqc
Daniel_8_82_396240_398720|hnangv haaix nor
Daniel_8_83_398720_405840|weic zuqc naaiv deix hinc yaangh nyei sic gorngv zuqc dingc ziangx setv mueiz nyei jauv
Daniel_8_84_405840_411000|dongh meih buatc cuotv i norm jorng nyei ba gi yungh gouv
Daniel_8_85_411000_416160|se mi ndie caux besie guoqv nyei hungh
Daniel_8_86_416160_420800|wuov dauh yungh gouv se gikc guoqv nyei hungh
Daniel_8_87_420800_428400|i norm m zing mbu ndongx nyei domh jorng se wuov norm guoqv nyei daauh dauh hungh diex
Daniel_8_88_428400_433520|nauv mingh wuov norm jorng nqa haav aengx cuotv biei norm jorng
Daniel_8_89_433520_438800|se yiem daauh norm guoqv cuotv daaih nyei biei norm guoqv
Daniel_8_90_438800_442440|mv baac maiv ndongc daauh norm henv
Daniel_8_91_442440_446080|naaiv deix guoqv nyei setv mueiz hnoi aav lamh taux
Daniel_8_92_446080_451320|baamz zuiz mienh nyei zuiz buangv soux mouc
Daniel_8_93_451320_455080|maaih dauh hungh diex oix cuotv daaih
Daniel_8_94_455080_456520|hmien ciouv nyei
Daniel_8_95_456520_460640|ninh haih longc guv guaix nyei waac nduov mienh
Daniel_8_96_460640_467600|ninh nyei qaqv oix henv jienv faaux mv baac maiv zeiz laaix kaux ganh nyei qaqv
Daniel_8_97_467600_472800|ninh yaac oix zoux cuotv baaic waaic nyei jauv gamh nziex haic
Daniel_8_98_472800_477400|ninh oix zoux nyei sic ninh zoux duqv cuotv nyei
Daniel_8_99_477400_482960|ninh oix mietc nzengc maaih qaqv nyei mienh caux tin hungh nyei cing nzengc baeqc fingx
Daniel_8_100_482960_490560|ninh oix longc guv guaix nyei za eix bun nduov mienh nyei sic camv jienv faaux
Daniel_9_1_8000_11560|cuotv seix benx mi ndie mienh
Daniel_9_2_11560_15000|aa haa su e latv nyei dorn
Daniel_9_4_16640_22040|liepc zoux ken ndie guoqv nyei hungh daauh hnyangx wuov hnyangx
Daniel_9_5_22040_25800|se ninh zueiz weic gunv da yietv hnyangx
Daniel_9_6_25800_28080|yie ndaa ni en
Daniel_9_7_28080_35600|doqc sou buatc ziouc hiuv duqv ziux ziouv mbuox douc waac mienh ye le mi nyei waac
Daniel_9_8_35600_42600|ye lu saa lem oix zuqc benx ndau huaang buangv cietv ziepc hnyangx
Daniel_9_9_42600_46160|yie ziouc huin mingh lorz ziouv tin hungh
Daniel_9_10_46160_49640|yie zei maiv nyanc haaix nyungc
Daniel_9_11_49640_53040|zuqv jienv la maah ndie cou
Daniel_9_12_53040_58720|aengx zueiz jienv saaiv ndui daux gaux jouh tin hungh
Daniel_9_13_58720_62280|yie daux gaux nyiemc zuiz bun ziouv
Daniel_9_14_62280_64640|yie nyei tin hungh
Daniel_9_15_64640_66520|yie gorngv
Daniel_9_16_66520_68680|o ziouv aac
Daniel_9_17_68680_70360|hlo haic
Daniel_9_18_70360_73520|mbuoqc horngh haic nyei tin hungh
Daniel_9_19_73520_78480|meih ei jienv meih laengz jiex nyei ngaengc waac
Daniel_9_20_78480_86120|yaac ziepc zuoqv nyei hnamv dongh hnamv meih yaac ei meih nyei leiz latc nyei mienh
Daniel_9_40_176800_179760|yie mbuo nyei tin hungh
Daniel_9_41_179760_184160|meih korv lienh aengx guangc yie mbuo nyei zuiz
Daniel_9_42_184160_187080|yie mbuo maiv muangx ziouv
Daniel_9_43_187080_189160|yie mbuo nyei tin hungh nyei waac
Daniel_9_44_189160_191960|dongh meih longc meih nyei bou
Daniel_9_45_191960_196720|zuangx douc waac mienh
Daniel_9_46_196720_200640|jiu bun yie mbuo nyei leiz latc
Daniel_9_47_200640_205480|i saa laa en nyei zuangx mienh baamz meih nyei leiz latc
Daniel_9_48_205480_208920|maiv kangv muangx meih nyei waac
Daniel_9_49_208920_212440|laaix yie mbuo baamz zuiz dorngc meih
Daniel_9_50_212440_216080|yie mbuo ziouc zuqc dongh meih nyei bou
Daniel_9_51_216080_218000|mose
Daniel_9_52_218000_224640|fiev jienv leiz latc sou wuov deix zioux nyei caux houv nyei waac
Daniel_9_53_224640_228080|meih ei jienv meih gorngv nyei waac zoux
Daniel_9_54_228080_233800|ziouc bun yie mbuo caux gunv yie mbuo wuov deix zuqc domh zeqc naanc
Daniel_9_55_233800_240080|yiem lungh ndiev maiv maaih haaix norm dorngx zuqc jiex hnangv ye lu saa lem
Daniel_9_56_240080_243760|hnangv fiev jienv mose nyei leiz latc nor
Daniel_9_57_243760_247840|yie mbuo zuqc naaiv deix yietc zungv zeqc naanc
Daniel_9_58_247840_251440|mv baac yie mbuo corc maiv lorz ziouv
Daniel_9_59_251440_253760|yie mbuo nyei tin hungh
Daniel_9_60_253760_255640|nyei en
Daniel_9_61_255640_260160|huin nzuonx daaih leih nqoi yie mbuo nyei zuiz
Daniel_9_62_260160_263440|ei jienv meih nyei zien leiz zoux
Daniel_9_63_263440_269440|ziouv  liuc leiz ziangx yaac bun yie mbuo zuqc naaiv deix zeqc naanc
Daniel_9_64_269440_271760|weic zuqc ziouv
Daniel_9_65_271760_274120|yie mbuo nyei tin hungh
Daniel_9_66_274120_276280|zoux haaix nyungc
Daniel_9_67_276280_278560|ninh zoux duqv horpc
Daniel_9_68_278560_282960|mv baac yie mbuo corc maiv muangx meih nyei waac
Daniel_9_69_282960_285080|o ziouv
Daniel_9_70_285080_286800|yie mbuo nyei tin hungh aac
Daniel_9_71_286800_295360|meih longc meih henv haic nyei buoz dorh meih nyei baeqc fingx cuotv i yipv deic bung
Daniel_9_72_295360_300000|meih ganh yaac duqv mengh dauh taux ih jaax hnoi
Daniel_9_73_300000_302840|yie mbuo baamz zuiz
Daniel_9_74_302840_305840|yie mbuo zoux orqv sic
Daniel_9_75_305840_307040|o ziouv aac
Daniel_9_76_307040_310800|ziux meih zoux horpc nyei yietc zungv sic
Daniel_9_77_310800_315440|tov guangc nqoi maiv dungx qiex jiez
Daniel_9_78_315440_318760|maiv dungx nouz meih nyei zingh
Daniel_9_79_318760_320520|meih nyei cing nzengc mbong
Daniel_9_80_320520_324120|ye lu saa lem
Daniel_9_81_324120_333920|yie mbuo nyei zuiz caux yie mbuo nyei ong taaix nyei zuiz bun ye lu saa lem caux meih nyei baeqc fingx zuqc weih gormx nyei zuangx mienh huotv
Daniel_9_82_333920_338440|o yie nyei tin hungh aac
Daniel_9_83_338440_343960|ih zanc tov muangx meih nyei bou daux gaux jouh nyei waac
Daniel_9_84_343960_345160|o ziouv aac
Daniel_9_85_345160_352600|tov weic meih ganh bun meih nyei hmien aengv cuotv njang ziux meih nyei singx dinc
Daniel_9_86_352600_357840|se zuqc baaic waaic nyei singx dinc
Daniel_9_87_357840_359640|o yie nyei tin hungh aac
Daniel_9_88_359640_362360|tov baeng m normh muangx
Daniel_9_89_362360_373720|tov nungx nqoi meih nyei m zing mangc yie mbuo zuqc nyei kouv naanc caux gan meih nyei mbuox heuc wuov norm zuqc baaic waaic nyei zingh
Daniel_9_90_373720_381240|yie mbuo daux gaux jouh meih se maiv zeiz weic yie mbuo ganh zoux duqv horpc
Daniel_9_91_381240_385360|se weic meih maaih hnyouv korv lienh
Daniel_9_92_385360_386480|o ziouv aac
Daniel_9_93_386480_389880|tov muangx
Daniel_9_94_389880_391160|o ziouv aac
Daniel_9_95_391160_393400|tov guangc nqoi
Daniel_9_96_393400_398160|tov ziouv muangx haiz yaac zoux aqv
Daniel_9_97_398160_399440|yie nyei tin hungh aac
Daniel_9_98_399440_402840|weih meih ganh maiv dungx ngaih
Daniel_9_99_402840_409160|weic zuqc meih nyei zingh caux meih nyei baeqc fingx gan meih nyei mbuox heuc
Daniel_9_100_409160_414480|gaa mbe li en porv mengh zinh hoz waac
Daniel_9_101_414480_417560|yie daux gaux jienv mingh
Daniel_9_102_417560_423960|nyiemc yie ganh nyei zuiz caux yie juangc i saa laa en fingx nyei mienh nyei zuiz
Daniel_9_103_423960_429400|yaac weic yie nyei tin hungh nyei cing nzengc mbong yiem ziouv
Daniel_9_104_429400_433240|yie nyei tin hungh nyei nza hmien
Daniel_9_105_433240_437320|corc daux gaux jienv wuov zanc
Daniel_9_106_437320_442560|yie buatc dongh zinh ndaangc yiem wuov nzunc laauc yaangh nyei sic wuov dauh mienh
Daniel_9_107_442560_444760|gaa mbe lien
Daniel_9_108_444760_448600|siepv siepv nyei ndaix daaih lorz yie
Daniel_9_109_448600_451600|wuov zanc se lungh maanz hmuangx
Daniel_9_110_451600_454600|fongc horc ziec nyei ziangh hoc
Daniel_9_111_454600_459120|gaa mbe lien gorngv mengh mbuox yie
Daniel_9_112_459120_461000|o ndaa ni en aac
Daniel_9_113_461000_466720|yie ih zanc daaih bun meih maaih cong mengh yaac haih bieqc hnyouv
Daniel_9_114_466720_472600|meih jiez gorn daux gaux jouh wuov zanc tin hungh ziouc dau meih
Daniel_9_115_472600_477640|yie daaih mbuox meih weic zuqc ninh hnamv meih camv nyei
Daniel_9_116_477640_488240|weic naaiv meih oix zuqc longx longx nyei hnamv aengx bieqc hnyouv naaiv deix hinc yaangh nyei sic
Daniel_9_117_488240_500000|tin hungh dingc weic meih nyei baeqc fingx caux meih nyei cing nzengc zingh maaih cietv ziepc norm leiz baaix oix zoux bun baamz zuiz nyei jauv dangx nzengc
Daniel_9_118_500000_500920|nzaaux nzengc
Daniel_9_119_500920_503120|fiqv nzengc zuiz
Daniel_9_120_503120_507320|dorh yietc liuz baengh fim nyei jauv bieqc daaih
Daniel_9_135_586000_591560|yaac maaih zeqc naanc nyei sic ziux dingc ziangx
Daniel_9_136_591560_598480|ninh caux mienh camv liepc jiez yietc norm leiz baaix nyei ngaengc waac
Daniel_9_137_598480_608520|mv baac jiex liuz ndaamv norm leiz baaix ninh oix bun fongc horc caux buov ziec nyei jauv louc dingh
Daniel_9_138_608520_615680|zoux bun nyungc nyungc waaic wuov dauh domh hieh youx ziouc taux aqv
Daniel_9_139_615680_621720|taux dingc daaih nyei setv mueiz dox cuotv bun ninh
Ecclesiastes_10_1_8000_14451|mungz daic zoux bun ndaang nyei youh zueix mingh
Ecclesiastes_10_2_14480_20918|diqv dien hngongx nyei jauv yaac haih zoux waaic cong mengh caux njang laangc
Ecclesiastes_10_3_20960_26227|cong mengh mienh nyei hnyouv dorh ninh oix zoux horpc
Ecclesiastes_10_4_26280_31417|mienh hngongx mienh nyei hnyouv dorh ninh mingh zoux dorngc
Ecclesiastes_10_5_31480_36087|mienh hngongx mienh yangh gan jienv jauv mingh
Ecclesiastes_10_6_36160_39241|ninh maiv jangx haaix nyungc
Ecclesiastes_10_7_39320_45868|ninh ganh zungv bun zuangx mienh zieqv duqv ninh se mienh hngongx mienh
Ecclesiastes_10_8_45960_50498|se gorngv gunv meih wuov dauh qiex jiez meih
Ecclesiastes_10_9_50600_53612|maiv dungx cuotv meih nyei dorngx
Ecclesiastes_10_10_53720_57325|weic zuqc hnyouv nyienz duqv
Ecclesiastes_10_11_57440_60239|haih tengx simv nqoi
Ecclesiastes_10_12_60360_63752|maiv benx sic hlo
Ecclesiastes_10_13_63880_69181|yie buatc yiem seix zaangc maaih yietc nyungc orqv sic
Ecclesiastes_10_14_69320_76846|se benx yietc nyungc dorngc nyei sic yiem zoux hlo gunv sic mienh cuotv daaih
Ecclesiastes_10_15_77000_82275|se duqv liepc mienh hngongx mienh faaux hlang nyei weic
Ecclesiastes_10_16_82440_86386|butv zoih mienh zueiz aiv nyei weic
Ecclesiastes_10_17_86560_90738|yie buatc zoux nouh nyei mienh geh maaz
Ecclesiastes_10_18_90920_96247|yaac buatc zoux hlo nyei mienh yangh jauv hnangv nouh nor
Ecclesiastes_10_19_96440_98362|haaix dauh wetv kuotv
Ecclesiastes_10_20_98560_102953|nziex ninh zuqc ndortv kuotv gu nyuoz
Ecclesiastes_10_21_103160_105827|haaix dauh mborqv tong laatc
Ecclesiastes_10_22_106040_109221|nziex naang haih nyorqv ninh
Ecclesiastes_10_23_109440_112494|haaix dauh zuqc la bieiv
Ecclesiastes_10_24_112720_116566|nziex la bieiv haih hoic ninh mun
Ecclesiastes_10_25_116800_119839|haaix dauh piqv ndiangx ndongh
Ecclesiastes_10_26_120080_123432|nziex zuqc ndiangx hoic ninh
Ecclesiastes_10_27_123680_126706|se gorngv bouv ndorngv mingh
Ecclesiastes_10_28_126960_129899|mienh yaac maiv nzioux laic
Ecclesiastes_10_29_130160_133971|ninh oix zuqc longc qaqv camv
Ecclesiastes_10_30_134240_138961|mv baac cong mengh haih tengx mienh zoux duqv cuotv
Ecclesiastes_10_31_139240_144869|maiv gaengh zoux faatv bun naang ziouc zuqc naang nyorqv ndaangc
Ecclesiastes_10_32_145160_148821|nqa haav zoux faatv bun naang nyei mienh maiv duqv haaix nyungc aqv
Ecclesiastes_10_33_149120_155528|cong mengh mienh nyei nzuih gorngv cuotv maaih en zingh nyei waac
Ecclesiastes_10_34_155840_160159|mv baac mienh hngongx mienh nyei nzuih haih mietc ganh
Ecclesiastes_10_35_160480_166067|mienh hngongx mienh nyei nzuih jiez gorn gorngv benx hngongx nyei waac
Ecclesiastes_10_36_166400_171536|setv mueiz waac benx orqv nyei buv longh buv dangv waac
Ecclesiastes_10_37_171880_175009|mienh hngongx mienh gorngv waac camv
Ecclesiastes_10_38_175360_179799|maiv maaih mienh hiuv duqv oix maaih haaix nyungc sic cuotv
Ecclesiastes_10_39_180160_183232|maiv maaih haaix dauh haih mbuox ninh
Ecclesiastes_10_40_183600_187544|ninh daic mingh nqa haav maaih haaix nyungc sic
Ecclesiastes_10_60_255640_259879|nyaanh yaac haih bun mienh zoux duqv nyungc nyungc
Ecclesiastes_10_61_260400_265268|maiv dungx zioux hungh diex liemh maiv dungx yiem hnyouv zioux
Ecclesiastes_10_62_265800_269739|yaac maiv dungx yiem gen zioux butv zoih mienh
Ecclesiastes_10_63_270280_274649|nziex ndaamv lungh nyei norqc haih ndaam meih nyei waac mingh
Ecclesiastes_10_64_275200_278960|maaih ndaatv nyei ga naaiv haih zunh meih gorngv nyei waac
Ecclesiastes_11_1_7000_10498|zorqv meih nyei laangh ziqc haaz njiec wuom minc
Ecclesiastes_11_2_10520_15928|weic zuqc nqa haav ziex hnoi meih ziouc aengx lorz buatc daaih
Ecclesiastes_11_3_15960_20958|zorqv buonc bun siec dauh mienh
Ecclesiastes_11_4_21000_24510|zungv bun taux hietc dauh
Ecclesiastes_11_5_24560_30658|weic zuqc meih maiv hiuv duqv yiem naaiv lungh ndiev oix maaih haaix nyungc zeqc naanc
Ecclesiastes_11_6_30720_34690|se gorngv mbuonx maaih wuom buangv
Ecclesiastes_11_7_34760_38602|ninh ziouc dox njiec ndau beih aqv
Ecclesiastes_11_8_38680_44311|maiv gunv ndiangx nauv mingh naamh bung fai baqv bung
Ecclesiastes_11_9_44400_48582|nauv njiec haaix norm dorngx ziouc yiem wuov aqv
Ecclesiastes_11_10_48680_53293|haaix dauh mangc nziaaux ziouc maiv haaz nyim
Ecclesiastes_11_11_53400_57125|haaix dauh mangc mbuonx maiv duqv gaatv mbiauh
Ecclesiastes_11_12_57240_62035|hnangv meih maiv hiuv duqv nziaaux yiem haaix diuc jauv daaih
Ecclesiastes_11_13_62160_65069|fai yiem maa nyei ga sie
Ecclesiastes_11_14_65200_70059|gu nguaaz nyei mbungv hnangv haaix nor haih benx daaih
Ecclesiastes_11_15_70200_74650|fih hnangv nyei meih maiv haih mengh baeqc tin hungh
Ecclesiastes_11_16_74800_78163|dongh zeix maanc muotc wuov dauh
Ecclesiastes_11_17_78320_80239|zoux nyei gong
Ecclesiastes_11_18_80400_84430|lungh ndorm meih oix zuqc haaz meih nyei nyim
Ecclesiastes_11_19_84600_88941|lungh maanz hmuangx yaac maiv dungx bun meih nyei buoz dingh
Ecclesiastes_11_20_89120_93492|weic zuqc meih maiv hiuv duqv haaix nyungc cuotv daaih longx
Ecclesiastes_11_21_93680_98482|lungh ndorm haaz nyei fai lungh muonz haaz nyei
Ecclesiastes_11_22_98680_102953|fai i nyungc zungv fih hnangv longx nyei
Ecclesiastes_11_23_103160_105508|njang m daaih longx nyei
Ecclesiastes_11_24_105720_110259|m zing buatc mba hnoi ziouc haiz a hneiv nyei
Ecclesiastes_11_25_110480_114251|se gorngv mienh ziangh duqv camv hnyangx
Ecclesiastes_11_26_114480_118841|gunv bun mienh a hneiv naaiv deix yietc zungv hnyangx daauh
Ecclesiastes_11_27_119080_127464|mv baac bun ninh jangx taux hmuangx nyei hnoi nyieqc weic zuqc naaiv deix hnoi nyieqc zungv maaih camv
Ecclesiastes_11_28_127720_130458|nyungc nyungc cuotv daaih nyei sic se kungx morngh
Ecclesiastes_11_29_130720_134570|kuinx mienh lunx mienh
Ecclesiastes_11_30_134840_136765|mienh lunx mienh aacEcclesiastes_12_1_5000_9820|hnyangx jeiv lunx nyei ziangh hoc oix zuqc jangx jienv zeix meih daaih wuov dauh
Ecclesiastes_12_2_9840_16087|kouv naanc nyei hnoi nyieqc maiv gaengh taux meih zungv oix gorngv
Ecclesiastes_12_3_16120_22514|yiem naaiv deix hnyangx nyei hnoi nyieqc maiv maaih haaix nyungc tengx yie a hneiv
Ecclesiastes_12_4_22560_26786|maiv dungx zuov taux mba hnoi caux njang
Ecclesiastes_12_5_26840_30458|hlaax caux hleix hmuangx mingh
Ecclesiastes_12_6_30520_32694|mbiungc nzengc
Ecclesiastes_12_7_32760_35249|mbuonx yaac nzuonx
Ecclesiastes_12_8_35320_39440|wuov hnoi goux biauv nyei mienh sin zinx
Ecclesiastes_12_9_39520_42554|mienh henv mienh jaaiv jutv
Ecclesiastes_12_10_42640_47784|morc mbuonv nyei mienh dingh njiec weic zuqc ninh mbuo zoqc
Ecclesiastes_12_11_47880_51736|mangc cuotv fong muonh nyei mienh m zing huon huaa
Ecclesiastes_12_12_51840_56167|cuotv wuov jauv nyei gaengh guon jienv
Ecclesiastes_12_13_56280_60239|morc mbuonv nyei qiex yaac faix jienv njiec
Ecclesiastes_12_14_60360_62434|norqc heuc
Ecclesiastes_12_15_62560_65628|mienh ziouc jiez sin daaih
Ecclesiastes_12_16_65760_69620|baaux nzung nyei sieqv baaux nzung qiex faix
Ecclesiastes_12_17_69760_72614|mienh gamh nziex hlang nyei dorngx
Ecclesiastes_12_18_72760_77045|caux yiem jauv zaangc maaih ciouv nyei sic
Ecclesiastes_12_19_77200_80518|an man ndiangx nqoi biangh
Ecclesiastes_12_20_80680_84191|jopv nyeic tor ganh nyei sin mingh
Ecclesiastes_1_10_40240_42840|yietc doic taux
Ecclesiastes_1_11_42840_47080|mv baac baamh gen yietc liuz yiem
Ecclesiastes_1_12_47080_52080|mba hnoi cuotv daaih mba hnoi aengx ndortv mingh
Ecclesiastes_1_13_52080_57480|yaac siepv siepv nyei nzuonx taux ninh cuotv nyei dorngx
Ecclesiastes_1_14_57480_61240|nziaaux buonc mingh naamh bung
Ecclesiastes_1_15_61240_64400|guinh nzuonx baqv bung
Ecclesiastes_1_16_64400_68160|buonc guinh mingh guinh daaih
Ecclesiastes_1_17_68160_72120|aengx buonc gan loz jauv nzuonx
Ecclesiastes_1_18_72120_76800|diuh diuh ndoqv liouc mingh gapv koiv
Ecclesiastes_1_19_76800_80680|mv baac koiv yaac maiv buangv
Ecclesiastes_1_20_80680_84080|wuom yiem haaix liouc daaih
Ecclesiastes_1_40_166520_172960|tin hungh bun baamh mienh ging jiex nyei sic za gengh aqc nyei
Ecclesiastes_1_41_172960_176800|kouv nyei
Ecclesiastes_1_42_176800_180960|yie buatc yiem lungh ndiev zoux nyei nyungc nyungc sic se kungx morngh
