Proverbs_20_45_185360_189450|oix zuqc caangh laangh weic daav cuotv za eix
Proverbs_20_46_189640_194125|oix mborqv domh jaax oix zuqc longc cong mengh dorh
Proverbs_20_47_194320_198880|gorngv waac huv nyei mienh sing gem jienv nyei sic
Proverbs_20_48_199080_203995|hnangv naaic maiv dungx caux nzuih piatv nyei mienh zoux doic
Proverbs_20_49_204200_208271|se gorngv mienh zioux ninh nyei diex maac
Proverbs_20_50_208480_213786|ninh ziouc daic hnangv dang yiem hmuangx nyei dorngx daic nor
Proverbs_21_40_183200_189849|haaix dauh oix haic a ngunc diuv caux ga lanv youh maiv haih butv zoih
Proverbs_21_41_190040_194045|orqv mienh zuqc kouv div kuv mienh
Proverbs_21_42_194240_200878|maiv ziepc zuoqv nyei mienh yaac zuqc kouv div hnyouv zingx nyei mienh
Proverbs_21_43_201080_205993|yiem deic bung huaang zungv gauh longx caux nzaeng jaax la ngopv nyei m sieqv dorn yiem
Proverbs_21_44_206200_213666|cong mengh mienh nyei biauv maaih jaaix nyei ga naaiv caux ga lanv youh
Proverbs_21_45_213880_219140|mv baac mienh hngongx mienh naqv nzengc ninh maaih nyei yietc zungv
Proverbs_21_46_219360_225694|zimh lorz zoux horpc zoux longx nyei jauv nyei mienh duqv maengc ziangh yaac duqv mienh taaih
Proverbs_21_47_225920_232447|cong mengh mienh nyorng faaux mienh henv mienh nyei zingh laatc
Proverbs_21_48_232680_237122|yaac baaic waaic mienh kaux wuonv nyei dorngx
Proverbs_21_49_237360_241198|haaix dauh goux ganh nyei nzuih caux mbietc
Proverbs_21_50_241440_244355|beu duqv ganh maiv zuqc sic
Proverbs_21_51_244600_246273|zoux maux
Proverbs_21_52_246520_250069|ceng hlo nyei mienh duqv mbuox heuc
Proverbs_21_53_250320_252107|ga naaiv huotv
Proverbs_21_54_252360_254505|ninh kungx zoux maux
Proverbs_21_55_254760_256942|ceng hlo hnangv
Proverbs_21_56_257200_263016|mienh lueic mienh nyei hnyouv oix nyei se hnangv daix ninh ganh
Proverbs_21_57_263280_267212|weic zuqc ninh nyei buoz maiv kangv zoux gong
Proverbs_21_58_267480_270729|ninh ziangh hnoi mauv oix duqv ga naaiv
Proverbs_21_59_271000_275244|mv baac kuv mienh bun yaac maiv korv fiqv
Proverbs_21_60_275520_279520|orqv mienh ziec nyei ga naaiv se gamh nziev nyei
Proverbs_21_61_279800_283596|ninh longc orqv nyei za eix dorh daaih zungv gauh fatv kouv
Proverbs_21_62_283880_289030|zoux jaav zorng zengx nyei mienh oix zuqc mietc
Proverbs_21_63_289320_294225|mv baac muangx zien zorng zengx nyei waac wuov dauh
Proverbs_21_64_294520_297741|ninh nyei waac yietc liuz yiem
Proverbs_21_65_298040_301418|orqv mienh zoux hmien hoz
Proverbs_21_66_301720_303616|maiv hiuv duqv nyaiv
Proverbs_21_67_303920_310049|mv baac hnyouv zingx nyei mienh longx longx nyei hnamv taux ganh nyei jauv
Proverbs_21_68_310360_318161|maiv maaih haaix nyungc cong mengh fai wuonh zaang fai caangh laangh nyei waac haih hingh jiex ziouv
Proverbs_21_69_318480_322996|maaz liuc leiz ziangx weic mborqv jaax nyei hnoi
Proverbs_21_70_323320_326313|mv baac se ziouv  bun duqv hingh
Proverbs_22_25_107000_110449|haaix dauh a hneiv maaih cing nzengc hnyouv
Proverbs_22_26_110560_114285|ninh nyei waac yaac maaih en zingh
Proverbs_22_27_114400_119400|wuov dauh ziouc duqv hungh diex zoux ninh nyei doic
Proverbs_22_28_119520_123116|ziouv nyei m zing goux jienv wuonh zaang
Proverbs_22_29_123240_128151|mv baac ninh mbienv maiv ziepc zuoqv nyei mienh nyei waac
Proverbs_22_30_128280_130389|mienh lueic mienh gorngv
Proverbs_22_31_130520_133826|ga nyiec maengx maaih dauh sienh
Proverbs_22_32_133960_138661|nziex yiem wuov jaai horngc yie haih zuqc ninh ngaatc daic
Proverbs_22_33_138800_144335|hienx nqox nyei m sieqv dorn nyei nzuih hnangv ndo haic nyei kuotv
Proverbs_22_34_144480_148970|ziouv qiex jiez nyei mienh zungv zuqc ndortv bieqc gu nyuoz
Proverbs_22_35_149120_153326|hngongx nyei jauv m daaih yiem fu jueiv nyei hnyouv
Proverbs_22_36_153480_158801|mv baac longc biaav mborqv njaaux haih zunc cuotv leih ninh go
Proverbs_22_37_158960_163796|haaix dauh zeix mienh jomc mienh weic douh ganh butv zoih
Proverbs_22_38_163960_168151|fai fungx zingh nyeic bun butv zoih mienh
Proverbs_22_39_168320_171668|setv mueiz ninh ganh jomc mi aqv
Proverbs_22_40_171840_175104|faah ziepc ginc cong mengh waac
Proverbs_22_41_175280_179939|meih oix zuqc baeng m normh muangx cong mengh mienh nyei waac
Proverbs_22_42_180120_184215|yie njaaux nyei waac oix zuqc longc hnyouv muangx
Proverbs_22_43_184400_189170|se gorngv meih zaangh jienv naaiv deix waac yiem hnyouv
Proverbs_22_44_189360_193326|yaac liuc leiz ziangx zanc zanc haih gorngv
Proverbs_22_45_193520_196403|ziouc tengx meih horpc hnyouv aqv
Proverbs_22_46_196600_200759|yie ih hnoi njaaux nyei se dongh meih
Proverbs_22_47_200960_207112|meih ziouc haih hiuv duqv naaiv deix waac weic bun meih kaux ziouv
Proverbs_22_48_207320_215624|yie weic meih fiev faah ziepc ginc kuinx nyei waac caux wuonh zaang nyei waac maiv zeiz
Proverbs_22_49_215840_219420|yie oix bun meih hiuv duqv haaix nyungc horpc
Proverbs_22_50_219640_221738|haaix nyungc zien
Proverbs_22_51_221960_227732|weic bun meih haih longc zien waac dau paaiv meih mingh nyei mienh
Proverbs_22_52_227960_232447|maiv dungx caangv mienh jomc mienh nyei ga naaiv weic zuqc ninh jomc
Proverbs_22_53_232680_237722|yaac maiv dungx yiem zingh gaengh zeix doh naanc mienh
Proverbs_22_54_237960_242157|weic zuqc ziouv oix tengx ninh mbuo caengx sic
Proverbs_22_55_242400_243915|haaix dauh hoic ninh mbuo
Proverbs_22_56_244160_248591|ziouv oix hoic wuov dauh nyei maengc
Proverbs_22_57_248840_254585|maiv dungx caux hungh hec qiex jiez siepv nyei mienh daav loz gaeng
Proverbs_22_58_254840_259260|yaac maiv dungx caux ga qiex beqv nyei mienh mingh
Proverbs_22_59_259520_263016|nziex meih haih zuotc ninh nyei nyungc zoux
Proverbs_22_60_263280_266293|yaac zuqc koux hlopv zuqc ganh
Proverbs_23_1_4000_8831|meih caux zoux hlo nyei mienh juangc dieh nyanc hnaangx
Proverbs_23_2_8840_13666|oix zuqc samx longx haaix nyungc yiem meih nyei nza hmien
Proverbs_23_3_13680_17622|se gorngv meih zoux mauv nyanc nyei mienh
Proverbs_23_4_17640_22417|oix zuqc zorqv nzuqc zaeng jienv ganh nyei jaang ndiev
Proverbs_23_5_22440_26413|maiv dungx mauv nyanc ninh kuv haic nyei ga naaiv
Proverbs_23_6_26440_30449|weic zuqc se nduov mienh nyei lai hnaangx
Proverbs_23_7_30480_35164|maiv dungx laauh luic weic lorz zinh zoih
Proverbs_23_8_35200_39999|oix zuqc maaih cong mengh gaux haih dingh njiec
Proverbs_23_9_40040_46033|meih kungx bungx m zing mangc maiv lamh longc nyei zinh zoih fai
Proverbs_23_10_46080_50709|weic zuqc zinh zoih liemh zeih hnangv cuotv ndaatv
Proverbs_24_1_4000_7832|maiv dungx mueic jieqv orqv mienh
Proverbs_24_2_7840_12667|yaac maiv dungx maaih hnyouv oix caux ninh mbuo yiem
Proverbs_24_3_12680_17582|weic zuqc ninh mbuo nyei hnyouv daav doqc nyei za eix
Proverbs_24_4_17600_21698|ninh mbuo nyei nzuih gorngv orqv haic nyei waac
Proverbs_24_5_21720_25974|zoux biauv oix zuqc longc cong mengh
Proverbs_24_6_26000_30609|yaac longc mengh baeqc nyei za eix liepc daaih
Proverbs_24_7_30640_32847|maaih wuonh zaang
Proverbs_24_8_32880_36203|biauv ziouc maaih longx haic
Proverbs_24_9_36240_38721|jaaix haic nyei ga naaiv buangv
Proverbs_24_10_38760_43276|cong mengh mienh maaih qaqv hlo
Proverbs_24_11_43320_48031|maaih wuonh zaang nyei mienh jaa henv jienv faaux
Proverbs_24_12_48080_54225|weic zuqc meih mingh mborqv jaax oix zuqc bangc cong mengh nyei za eix
Proverbs_24_13_54280_57382|maaih caangh laangh nyei mienh camv ziouc duqv hingh jiex
Proverbs_24_14_57440_63536|cong mengh nyei jauv weic mienh hngongx mienh ba laqc hlang haic
Proverbs_24_15_63600_67532|yiem zingh gaengh ninh maiv gorngv haaix nyungc aqv
Proverbs_24_16_67600_74445|daav za eix zoux orqv sic wuov dauh ziouc duqv mienh heuc cuoqv sic mienh
Proverbs_24_17_74520_79120|hnamv cuotv zoux hngongx nyei sic benx zuiz
Proverbs_24_18_79200_83196|mienh yaac youx huotv mienh nyei mienh
Proverbs_24_19_83280_88551|se gorngv meih zuqc sic nyei hnoi meih hnyouv mau
Proverbs_24_20_88640_91708|meih nyei qaqv faix haic
Proverbs_25_1_9000_14105|yiem naaiv mingh yaac benx saa lo morn nyei cong mengh waac
Proverbs_25_2_14120_16583|dongh yu ndaa hungh
Proverbs_25_3_16600_20539|he se ki yaa nyei mienh ceu daaih
Proverbs_25_4_20560_25454|zorqv sic gem jienv benx tin hungh nyei njang laangc
Proverbs_25_5_25480_31648|mv baac hungh diex nyei njang laangc se ninh zorqv sic zaah cuotv daaih
Proverbs_25_6_31680_36163|lungh ndongc haaix hlang ndau ndongc haaix ndo
Proverbs_25_7_36200_41638|hungh diex nyei hnyouv yaac hnangv wuov nor zaah maiv toux
Proverbs_25_8_41680_44355|zorqv cuotv nyaanh nqaiv
Proverbs_25_9_44400_48751|nyaanh zaangc ziouc duqv nyaanh daav cuotv ga naaiv
Proverbs_25_10_48800_53746|zorqv nqoi yiem hungh diex nyei nza hmien nyei orqv mienh
Proverbs_25_11_53800_60139|ninh nyei hungh weic ziouc bangc baengh fim nyei jauv liepc gorn ndoqv wuonv
Proverbs_25_12_60200_65214|yiem hungh diex nyei nza hmien maiv dungx taaih ganh hlo
Proverbs_25_13_65280_70129|fai souv jienv zoux hlo nyei mienh nyei dorngx
Proverbs_25_14_70200_73246|weic zuqc maaih mienh gorngv
Proverbs_25_15_73320_75364|faaux naaiv oc
Proverbs_25_16_75440_81838|se gauh longx dorng jienv zoux hlo nyei mienh zuqc mienh heuc meih tuix njiec
Proverbs_25_17_81920_87912|meih nyei m zing buatc nyei maiv dungx siepv siepv nyei dorh mingh wuov sic dorngh
Proverbs_25_18_88000_93546|nziex maaih ganh nyei juangc laangz mienh daaih bun meih zuqc nyaiv
Proverbs_25_19_93640_97462|setv mueiz meih hnangv haaix nor zoux
Proverbs_25_20_97560_102097|se gorngv meih caux dauh juangc laangz mienh nzaeng
Proverbs_25_21_102200_105574|oix zuqc caux ninh mbenc sung
Proverbs_25_22_105680_110769|yaac maiv dungx dorh ninh gem jienv nyei sic mingh gorngv
Proverbs_25_23_110880_115044|nziex muangx haiz nyei mienh bun meih zuqc nyaiv
Proverbs_25_24_115160_119480|meih waaic nyei mengh dauh yaac maiv haih longx aqv
Proverbs_25_25_119600_123196|gorngv yietc joux waac puix duqv horpc ziangh hoc
Proverbs_25_26_123320_129110|se hnangv norm longc jiem zoux daaih nyei biouv lorqc jienv nyaanh lorqc
Proverbs_25_27_129240_138261|cong mengh mienh kuinx maaih m normh oix muangx nyei mienh se hnangv jiem buoz ndoqv nzaeng fai zien jiem zoux daaih nyei siou setv
Proverbs_25_28_138400_146133|ziepc zuoqv nyei douc fienx mienh bun paaiv ninh wuov deix ziouv nyei hnyouv fingv
Proverbs_25_29_146280_151528|hnangv siou gaeng zuangx nyei ziangh hoc maaih sorng tengx laangh
Proverbs_25_30_151680_157921|mienh bungx waac maux gorngv oix fungx zingh nyeic mv baac maiv fungx
Proverbs_25_31_158080_162837|se hnangv maaih mbuonx maaih nziaaux yaac maiv maaih mbiungc
Proverbs_25_32_163000_166553|longc noic yuoqc duqv zoux hlo nyei mienh
Proverbs_25_33_166720_172307|gorngv waac suonc zungv haih bun ninh nyei hnyouv mau njiec
Proverbs_25_34_172480_176703|se gorngv meih duqv mueiz dorngh oix zuqc nyanc horpc
Proverbs_25_35_176880_179580|nyanc camv jiex jaax nor
Proverbs_26_1_4000_9350|ceng mienh hngongx mienh se maiv puix
Proverbs_26_2_9360_12947|hnangv nqaai gorng duih sorng
Proverbs_27_1_4000_9550|maiv dungx bungx waac maux gorngv njang hnoi nyei sic
Proverbs_27_2_9560_16823|weic zuqc meih maiv hiuv duqv yietc hnoi yietc hnoi oix maaih haaix nyungc sic cuotv
Proverbs_27_3_16840_19740|bun ganh dauh ceng meih
Proverbs_27_4_19760_22817|maiv zeiz longc meih ganh nyei nzuih
Proverbs_27_5_22840_26133|bun nyiec nyei mienh ceng meih
Proverbs_27_15_58280_63256|se gauh longx maiv bun mienh hiuv duqv meih hnamv ninh
Proverbs_27_16_63320_69090|loz gaeng doic bun meih zuqc mun se ziepc zuoqv nyei zoux
Proverbs_27_17_69160_74685|mv baac win wangv zom hmien jiex ndaangc zien nyei jauv
Proverbs_27_18_74760_79360|nyanc beuv nyei mienh ziouc youx mueiz dorngh
Proverbs_27_19_79440_82677|mv baac hnyouv sie nyei mienh
Proverbs_27_20_82760_86633|liemh im nyei ga naaiv yaac gaam nyei
Proverbs_27_21_86720_89510|mienh leih nqoi ganh nyei biauv
Proverbs_27_22_89600_94785|se hnangv norm norqc leih nqoi ninh nyei lauz
Proverbs_27_23_94880_99900|youh ndaang caux wuom ndaang bun hnyouv a hneiv
Proverbs_27_24_100000_104855|loz gaeng doic longc hnyouv kuinx bun hnyouv orn lorqc
Proverbs_27_25_104960_111488|meih maiv dungx guangc meih nyei loz gaeng doic caux meih nyei die nyei loz gaeng doic
Proverbs_27_26_111600_117482|zuqc zeqc naanc nyei hnoi yaac maiv dungx mingh meih nyei muoz doic nyei biauv
Proverbs_27_27_117600_122916|yiem fatv nyei juangc laangz mienh se gauh longx yiem go nyei muoz doic
Proverbs_27_28_123040_125154|yie nyei dorn aac
Proverbs_27_29_125280_128431|meih oix zuqc zoux cong mengh mienh
Proverbs_27_30_128560_131828|yaac bun yie nyei hnyouv njien youh
Proverbs_27_31_131960_134545|haaix dauh daanh yie
Proverbs_27_32_134680_137622|yie ziouc maaih waac dau
Proverbs_27_33_137760_142857|mienh guai mienh buatc haih maaih sic cuotv ziouc simv nqoi
Proverbs_27_34_143000_148890|mv baac maiv hiuv haaix nyungc nyei mienh hungx jienv mingh ziouc zuqc kouv aqv
Proverbs_27_35_149040_152607|se gorngv mienh beu ga nyiec nyei mienh
Proverbs_27_55_231920_234125|yietc liuz maiv buangv
Proverbs_27_56_234360_237602|mienh nyei m zing buatc oix duqv nyei
Proverbs_27_57_237840_240759|yietc liuz yaac maiv gaux
Proverbs_27_58_241000_244874|nyaanh korqv se weic sinx nyaanh
Proverbs_27_59_245120_247512|louh se weic sinx jiem
Proverbs_27_60_247760_253266|ceng nyei waac yaac haih seix duqv cuotv mienh
Proverbs_27_61_253520_262017|maiv gunv zorqv mienh hngongx mienh caux zong muonc nyei mbiauh dapv jienv da komv aengx longc da juih zong
Proverbs_27_62_262280_266533|mienh hngongx mienh m daaih hnangv naaic hngongx aqv
Proverbs_27_63_266800_271967|meih oix zuqc hiuv duqv meih nyei ba gi yungh guanh hnangv haaix nor
Proverbs_27_64_272240_275724|yaac mangc longx meih nyei ngongh guanh
Proverbs_27_65_276000_279959|weic zuqc zinh zoih maiv haih yietc liuz maaih
Proverbs_27_66_280240_285394|hungh ningv yaac haih yiem taux maanc gouv maanc doic fai
Proverbs_27_67_285680_288351|gaatv miev nqaai mingh
Proverbs_27_68_288640_291708|miev lunx aengx cuotv daaih
Proverbs_27_69_292000_296063|mbong zaangc nyei lai miev yaac siou nzengc
Proverbs_27_70_296360_303496|wuov zanc meih ziouc duqv ba gi yungh dorn nyei biei weic zoux meih nyei lui houx
Proverbs_27_71_303800_307851|yungh yaac benx lingh deic nyei jaax zinh
Proverbs_27_72_308160_312647|maaih yungh nyorx gaux zoux meih nyei nyanc hopv
Proverbs_27_73_312960_316523|yaac gaux meih nyei yietc biauv mienh
Proverbs_27_74_316840_319440|liemh meih nyei m sieqv bou
Proverbs_28_20_95840_101258|liemh ninh daux gaux nyei waac benx tin hungh funx youx haic
Proverbs_28_21_101360_104055|gamh nziev haic nyei sic
Proverbs_28_22_104160_109370|haaix dauh nduov hnyouv zingx nyei mienh yangh orqv nyei jauv
Proverbs_28_23_109480_113886|wuov dauh ziouc ndortv njiec ninh ganh nyei kuotv
Proverbs_28_24_114000_120319|mv baac maiv maaih dorngx nqemh nyei mienh duqv nzipc longx nyei buonc
Proverbs_28_25_120440_123836|butv zoih mienh ziux ninh ganh mangc maaih cong mengh
Proverbs_28_26_123960_128271|mv baac haih samx duqv cuotv nyei mienh jomc mienh haih mangc duqv toux
Proverbs_28_27_128400_132227|kuv mienh duqv hingh
Proverbs_28_28_132360_134705|mienh zoux jorm
Proverbs_28_29_134840_136783|nauc nyitc
Proverbs_28_30_136920_140459|mv baac orqv mienh henv faaux
Proverbs_28_31_140600_142777|mienh ziouc bingx
Proverbs_28_32_142920_148091|haaix dauh buang jienv ninh ganh nyei zuiz maiv haih duqv longx
Proverbs_28_33_148240_153806|mv baac haaix dauh nyiemc ganh zoux dorngc nyei zuiz aengx guangc nqoi
Proverbs_28_34_153960_156803|ziouc duqv tin hungh korv lienh
Proverbs_28_35_156960_160878|mienh zanc zanc taaih ziouv ziouc duqv orn lorqc
Proverbs_28_36_161040_166153|mv baac zoux hnyouv ngaengc nyei mienh zuqc zeqc naanc hoic
Proverbs_28_37_166320_172906|zoux hlo nyei orqv mienh gunv mienh jomc mienh se hnangv sienh njunh nor
Proverbs_28_38_173080_175544|fai hnangv jiepv bieqc daaih borngz
Proverbs_28_39_175720_181058|zoux hlo gunv mienh nyei mienh maiv bieqc hnyouv
Proverbs_28_40_181240_183576|ninh ziouc zoux doqc
Proverbs_28_41_183760_185494|zeix mienh
Proverbs_28_42_185680_194165|mv baac haaix dauh youx maiv baengh fim nyei leic zinh ziouc bun ninh ziangh nyei hnoi nyieqc ndaauv
Proverbs_28_43_194360_199760|haaix dauh daix mienh bun nziaamv liouc cuotv ziouc dorngc zuiz
Proverbs_28_44_199960_203676|ninh oix zuqc bingx jienv biaux taux daic
Proverbs_28_45_203880_207192|maiv dungx bun haaix dauh tengx ninh
Proverbs_28_46_207400_211468|zoux duqv zingx nyei mienh duqv yiem longx
Proverbs_28_47_211680_216703|mv baac haaix dauh zoux sic ngau njuotv ziouc liemh zeih ndortv njiec kuotv
Proverbs_28_48_216920_223456|haaix dauh laih ganh nyei lingh deic duqv laangh ziqc nyanc beuv
Proverbs_28_49_223680_228571|mv baac haaix dauh gan maiv lamh longc nyei jauv ziouc za gengh jomc aqv
Proverbs_28_50_228800_233566|ziepc zuoqv nyei mienh duqv fuqv camv
Proverbs_28_51_233800_238161|mv baac oix siepv siepv nyei butv zoih wuov nyungc mienh
Proverbs_28_52_238400_242117|ndongc haaix zungv oix zuqc dingc zuiz
Proverbs_28_53_242360_246113|mangc mienh nyei hmien mbenc sic se maiv benx
Proverbs_28_54_246360_252107|mv baac weic duqv aax hnaangx nziex mienh haih zoux dorngc
Proverbs_28_55_252360_256543|mienh njapv mienh oix siepv siepv nyei butv zoih
Proverbs_28_56_256800_260299|yaac maiv hiuv duqv ninh ganh oix zuqc jomc
Proverbs_28_57_260560_262896|haaix dauh gorngv hemx mienh
Proverbs_28_58_263160_269090|nqa haav duqv mienh a hneiv gauh camv nzuih la guaih ceng nyei mienh
Proverbs_28_59_269360_274045|haaix dauh nimc ninh nyei diex maac nyei ga naaiv yaac gorngv
Proverbs_28_60_274320_276643|hnangv naaic se maiv dorngc
Proverbs_28_61_276920_279959|ninh se caux zoux mietc nyei mienh zoux doic
Proverbs_28_62_280240_285514|cei nyei mienh coqv cuotv nzaeng jaax nyei sic
Proverbs_28_63_285800_288711|mv baac haaix dauh kaux ziouv ziouc duqv longx
Proverbs_28_64_289000_293825|haaix dauh kaux ninh ganh nyei hnyouv se hngongx
Proverbs_28_65_294120_299020|mv baac haaix dauh gan cong mengh nyei jauv ziouc duqv njoux
Proverbs_28_66_299320_302577|haaix dauh nzie mienh jomc mienh
Proverbs_28_67_302880_306333|wuov dauh ziouc maiv caa haaix nyungc
Proverbs_28_68_306640_311568|mv baac haaix dauh buang jienv m zing hnangv maiv buatc nor
Proverbs_28_69_311880_315164|ziouc zuqc mienh camv nyei zioux
Proverbs_28_70_315480_318201|orqv mienh henv faaux
Proverbs_29_5_20040_23056|baeqc fingx njien youh
Proverbs_29_6_23080_27612|mv baac orqv mienh zoux hlo gunv mienh
Proverbs_29_7_27640_30729|baeqc fingx njunh jienv yiem
Proverbs_29_8_30760_33646|haaix dauh hnamv cong mengh
Proverbs_29_9_33680_37562|wuov dauh bun ninh nyei die a hneiv
Proverbs_29_10_37600_43436|mv baac haaix dauh caux maaic sin nyei m sieqv dorn jiu tong
Proverbs_29_11_43480_50389|wuov dauh zaaux nzengc ninh maaih nyei yietc zungv ga naaiv
Proverbs_29_12_50440_53306|hungh diex longc baengh fim nyei jauv
Proverbs_29_13_53360_56623|guoqv ziouc liepc duqv wuonv
Proverbs_29_14_56680_63975|mv baac hungh diex aapv baeqc fingx cuotv nyaanh hmuangx ziouc bun guoqv zuqc baaic
Proverbs_29_15_64040_71328|mienh la guaih ceng ninh nyei juangc laangz mienh se hnangv zaeng mungz nzenc ninh ganh nyei zaux
Proverbs_29_16_71400_79520|orqv mienh baamz zuiz se hnangv zuqc ganh nyei zuiz zoux koux hlopv jienv
Proverbs_29_17_79600_82956|mv baac kuv mienh njien youh
Proverbs_29_18_83040_84675|baaux nzung
Proverbs_29_19_84760_90349|kuv mienh hiuv duqv mienh jomc mienh horpc zuqc duqv nyei leiz
Proverbs_29_20_90440_95104|mv baac orqv mienh maiv bieqc hnyouv naaiv nyungc jauv
Proverbs_29_21_95200_101898|zoux huotv mienh nyei mienh coqv bun zingh nyei mienh lunc nzengc
Proverbs_29_22_102000_107252|mv baac cong mengh mienh haih donv duqv qiex jiez nyei jauv
Proverbs_29_23_107360_112727|se gorngv cong mengh mienh caux mienh hngongx mienh nzaeng
Proverbs_29_24_112840_117362|mienh hngongx mienh youc qiex jiez youc jatv
Proverbs_29_25_117480_119520|zungv maiv haih sekv
Proverbs_29_26_119640_126193|oix daix mienh nyei mienh hanc haic maiv maaih dorngx nqemh nyei mienh
Proverbs_29_27_126320_131828|orqv mienh lorz hnyouv zingx nyei mienh nyei maengc
Proverbs_29_28_131960_136703|mienh hngongx mienh bun ninh nyei ga qiex baetv cuotv nzengc
Proverbs_29_29_136840_141778|mv baac cong mengh mienh longc noic nyienz jienv
Proverbs_29_30_141920_146533|se gorngv zoux hlo nyei mienh muangx gorngv baeqc nyei waac
Proverbs_29_31_146680_151288|ninh nyei yietc zungv jien ziouc waaic nzengc
Proverbs_29_32_151440_157162|mienh jomc mienh caux zeix mienh nyei mienh maaih yietc diuc fih hnangv
Proverbs_29_33_157320_161598|se ziouv bun ninh mbuo i dauh nyei m zing njang
Proverbs_29_34_161760_166473|se gorngv hungh diex baengh fim nyei siemv mienh jomc mienh
Proverbs_29_35_166640_171308|ninh nyei hungh weic yietc liuz liepc wuonv
Proverbs_29_36_171480_175624|longc biaav mborqv njaaux yaac gorngv njaaux
Proverbs_29_37_175800_179100|fu jueiv ziouc jaa cong mengh
Proverbs_29_38_179280_184495|mv baac se gorngv sueih fu jueiv ei ganh nyei hnyouv zoux
Proverbs_29_39_184680_187492|ziouc bun maa zuqc nyaiv
Proverbs_29_40_187680_190169|orqv mienh duqv lingc gunv
Proverbs_29_41_190360_193566|zuiz nyei jauv jaa camv
Proverbs_29_42_193760_199360|mv baac kuv mienh duqv buatc ninh mbuo zuqc baaic waaic nzengc
Proverbs_29_43_199560_202357|oix zuqc mborqv njaaux meih nyei dorn
Proverbs_29_44_202560_206033|ninh ziouc bun meih duqv hitv kuonx
Proverbs_29_45_206240_210109|ninh yaac oix bun meih nyei hnyouv a hneiv
Proverbs_29_46_210320_214465|haaix norm dorngx maiv maaih laauc yaangh nyei jauv
Proverbs_29_47_214680_218541|baeqc fingx ziouc maiv muangx leiz gunv
Proverbs_29_48_218760_222217|mv baac gan longx leiz latc nyei mienh duqv orn lorqc
Proverbs_29_49_222440_228171|kungx longc waac gorngv njaaux bou hnangv se maiv gaux
Proverbs_29_50_228400_232487|maiv gunv ninh mengh baeqc ninh maiv ei jienv zoux
Proverbs_29_51_232720_236363|meih buatc nzuih siepv nyei mienh fai
Proverbs_29_52_236600_240918|mienh hngongx mienh zungv maaih lamh hnamv gauh camv ninh
Proverbs_29_53_241160_246033|bou faix nyei ziangh hoc meih ei ninh nyei hnyouv bun ga naaiv ninh
Proverbs_29_54_246280_252747|setv mueiz ninh zorqv nzengc meih maaih nyei yietc zungv ga naaiv
Proverbs_29_55_253000_256703|ga qiex beqv nyei mienh coqv cuotv nzaeng jaax nyei sic
Proverbs_29_56_256960_261977|hungh hec qiex jiez nyei mienh baamz zuiz camv
Proverbs_29_57_262240_266133|mienh zoux maux ninh ziouc ndortv njiec aiv
Proverbs_29_58_266400_271528|mv baac mienh nyiemc ganh zoux faix ziouc duqv mienh taaih
Proverbs_29_59_271800_277002|haaix dauh caux janx zaqc maaih buonc ziouc hanc ganh nyei maengc
Proverbs_29_60_277280_281877|ninh haiz mienh houv nyei waac yaac maiv gorngv haaix nyungc
Proverbs_29_61_282160_286073|mienh gamh nziex mienh se benx koux hlopv
Proverbs_29_62_286360_290309|mv baac haaix dauh kaux ziouv duqv yiem longx
Proverbs_29_63_290600_295024|mienh camv nyei lorz zoux hlo nyei mienh korv lienh
Proverbs_29_64_295320_298101|mv baac se ziouv bun mienh duqv baengh fim
Proverbs_29_65_298400_303975|hnyouv maiv zingx nyei mienh zuqc kuv mienh youx
Proverbs_29_66_304280_307372|hnyouv zingx nyei mienh zuqc orqv mienh youx
Proverbs_2_1_7000_8902|yie nyei dorn aah
Proverbs_2_2_8920_12175|se gorngv meih zipv yie nyei waac
Proverbs_2_3_12200_15528|goux longx yie hatc nyei lingc
Proverbs_2_4_15560_19480|meih baeng m normh muangx cong mengh nyei waac
Proverbs_2_5_19520_22714|yaac za gengh oix bieqc hnyouv
Proverbs_2_6_22760_24391|zeiz nyei
Proverbs_2_7_24440_28383|se gorngv meih heuc jienv tov oix mengh baeqc
Proverbs_2_8_28440_32534|yaac cuotv qiex tov bun bieqc hnyouv
Proverbs_2_9_32600_37165|se gorngv meih lorz cong mengh hnangv lorz nyaanh
Proverbs_2_10_37240_43393|zimh lorz cong mengh hnangv zimh lorz bingx jienv nyei zinh zoih
Proverbs_2_11_43480_48063|hnangv naaic meih ziouc mengh baeqc taaih ziouv
Proverbs_2_12_48160_51057|yaac hiuv duqv tin hungh
Proverbs_2_13_51160_55688|weic zuqc ziouv ceix cong mengh bun mienh
Proverbs_2_14_55800_62514|ninh nyei nzuih gorngv nyei waac maaih wuonh zaang yaac bun mienh bieqc hnyouv
Proverbs_2_15_62640_67903|ninh siou cong mengh weic tengx hnyouv zingx wuov deix
Proverbs_2_16_68040_72654|ninh hnangv torngv baaih beu jienv ziepc zuoqv nyei mienh
Proverbs_2_17_72800_76806|ninh goux baengh fim mienh nyei jauv
Proverbs_2_18_76960_82354|yaac beu jienv gan longx ninh wuov deix nyei jauv louc
Proverbs_2_19_82520_87344|wuov zanc meih ziouc mengh baeqc haaix nyungc horpc nyei
Proverbs_2_20_87520_89460|baengh fim nyei
Proverbs_2_21_89640_92055|zingx nyei
Proverbs_2_22_92240_95448|se yietc zungv longx nyei jauv
Proverbs_2_23_95640_99600|weic zuqc cong mengh oix bieqc meih nyei hnyouv
Proverbs_2_24_99800_104310|wuonh zaang yaac bun meih nyei hnyouv kuh yiem
Proverbs_2_25_104520_107784|guai nyei jauv oix beu jienv meih
Proverbs_2_26_108000_111736|bieqc hnyouv nyei jauv yaac goux jienv meih
Proverbs_2_27_111960_119360|aengx njoux meih biaux ndutv orqv mienh nyei jauv caux gorngv baeqc nyei mienh
Proverbs_2_28_119600_123512|naaiv nyungc mienh guangc zoux horpc nyei jauv
Proverbs_2_29_123760_126306|gan hmuangx nyei jauv louc yangh
Proverbs_2_30_126560_130019|ninh mbuo a hneiv zoux orqv sic
Proverbs_2_31_130280_134730|yaac oix haic orqv mienh zoux nyei jauv
Proverbs_2_32_135000_138282|ninh mbuo nyei jauv ngau njuotv
Proverbs_2_33_138560_142274|ninh mbuo zoux nyei jauv pien mi aqv
Proverbs_2_34_142560_147823|meih ziouc duqv simv nqoi hienx nqox nyei auv
Proverbs_2_35_148120_150977|se biaux ndutv nzuih mbiaangc
Proverbs_2_36_151280_154410|yuoqc mienh nyei m sieqv dorn
Proverbs_2_37_154720_161516|ninh guangc hnyangx jeiv lunx nyei ziangh hoc longc daaih nyei nqox
Proverbs_2_38_161840_166745|yaac la kuqv caux ninh nyei tin hungh laengz jiex nyei ngaengc waac
Proverbs_2_39_167080_169859|se gorngv mingh ninh nyei biauv
Proverbs_2_40_170200_173652|meih ziouc gan zuqc daic nyei jauv
Proverbs_2_41_174000_177604|mingh ninh wuov se hungx jienv yiemh gen mingh
Proverbs_2_42_177960_184470|da faanh mingh ninh wuov nyei mienh maiv maaih yietc dauh duqv nzuonx
