Genesis_38_35_119960_124280.wav|meih oix zuqc zoux auv guaav zuov yie nyei dorn qelaa hlo daaih
Genesis_38_36_124280_134200.wav|yu ndaa hnangv naaiv nor gorngv weic zuqc ninh yiem hnyouv hnamv nzauh heix qelaa daic hnangv ninh nyei gorx mbuo nor
Genesis_38_37_134200_139160.wav|taamaa ziouc nzuonx ninh nyei die nyei biauv mi aqv
Genesis_38_38_139160_143360.wav|jiex daaih yu ndaa nyei auv qu aa nyei sieqv
Genesis_38_39_143360_145240.wav|guei seix mi aqv
Genesis_38_40_145240_148120.wav|zuov nzauh nyei ziangh hoc jiex liuz
Genesis_38_41_148120_153080.wav|yu ndaa caux ninh nyei loz gaeng doic aa ndun lam mienh
Genesis_38_42_153080_156120.wav|hilaa mingh tim naa haa
Genesis_38_43_156120_161480.wav|maaih mienh tengx japv ninh nyei ba gi yungh biei wuov norm dorngx
Genesis_38_44_161480_163640.wav|maaih mienh mbuox taamaa
Genesis_38_45_163640_168080.wav|meih nyei ong buoc oix mingh tim naa haa japv ba gi yungh biei
Genesis_38_46_168080_172080.wav|taamaa ziouc yienc nqoi ninh nyei auv guaav lui houx
Genesis_38_47_172080_175400.wav|zorqv kuaaiv ndie buix jienv
Genesis_38_48_175400_177160.wav|mbiorngz jienv hmien
Genesis_38_49_177160_178840.wav|zorng ziangx
Genesis_38_50_178840_182800.wav|ninh zueiz jienv mingh tim naa haa nyei jauv hlen
Genesis_38_51_182800_187280.wav|bieqc e naa im mungv nyei zingh gaengh ndaangc
Genesis_38_52_187280_189600.wav|ninh hiuv duqv yu ndaa nyei dorn laai
Genesis_38_53_189600_191920.wav|qelaa hlo aqv
Genesis_38_54_191920_194520.wav|mv baac yu ndaa maiv bun ninh longc
Genesis_38_55_194520_197000.wav|yu ndaa buatc taamaa
Genesis_38_56_197000_200760.wav|laaic ninh zoux maaic buonv sin nyei m sieqv dorn
Genesis_38_57_200760_205680.wav|weic zuqc ninh maaih ndie mbiorngz jienv hmien
Genesis_38_58_205680_209000.wav|yu ndaa mingh wuov jauv hlen caux ninh gorngv waac
Genesis_38_59_209000_210080.wav|ninh gorngv
Genesis_38_60_210080_211160.wav|daaih maah
Genesis_38_61_211160_213400.wav|bun yie caux meih bueix oc
Genesis_38_62_213400_215920.wav|yu ndaa maiv hiuv duqv se ninh nyei mbuangz
Genesis_38_63_215920_217800.wav|taamaa naaic
Genesis_38_64_217800_219920.wav|yie caux meih bueix
Genesis_38_65_219920_222320.wav|meih bun haaix nyungc yie
Genesis_38_66_222320_223920.wav|yu ndaa dau
Genesis_38_67_223920_228920.wav|yie oix zorqv dauh yie nyei yungh guanh nyei yungh dorn bun meih
Genesis_38_68_228920_231440.wav|taamaa dau
Genesis_38_69_231440_237440.wav|meih oix longc haaix nyungc dingc jienv ndaangc taux meih fungx yungh dorn daaih
Genesis_38_70_237440_239200.wav|yu ndaa naaic gaax
Genesis_38_71_239200_242440.wav|meih oix yie dingc haaix nyungc ndaangc gauh longx
Genesis_38_72_242440_244720.wav|taamaa gorngv
Genesis_38_73_244720_254880.wav|oix zuqc bun meih nyei yienx caux ndiux yienx nyei hlaang aengx caux meih ih zanc nanv jienv naaiv diuh biaav mbiaac
Genesis_38_74_254880_258120.wav|yu ndaa ziouc zorqv daaih bun ninh mi aqv
Genesis_38_75_258120_260800.wav|bun jienv ziouc caux ninh bueix
Genesis_38_76_260800_264160.wav|nqa haav taamaa maaih jienv yu ndaa nyei gu nguaaz aqv
Genesis_38_77_264160_274080.wav|taamaa nzuonx mingh zorqv nqoi mbiorngz hmien nyei ndie aengx zuqv jienv ninh nyei auv guaav nyei lui houx hnangv loz wuov nor
Genesis_38_78_274080_279880.wav|yu ndaa mbuox ninh nyei loz gaeng doic wuov dauh aa ndun lam mienh
Genesis_38_79_279880_280680.wav|hilaa
Genesis_38_80_280680_285920.wav|dorh yungh dorn mingh zuoqc ninh dingc wuov deix ga naaiv nzuonx
Genesis_38_81_285920_290000.wav|hilaa mingh gau lorz maiv buatc wuov dauh m sieqv dorn
Genesis_38_82_290000_292800.wav|ninh ziouc naaic gaax wuov norm dorngx nyei mienh
Genesis_38_83_292800_300040.wav|yiem e naa im mungv nyei jauv hlen wuov dauh maaic buonv sin nyei m sieqv dorn jiex haaix mi aqv
Genesis_38_84_300040_302440.wav|ninh mbuo dau
Genesis_38_85_302440_306480.wav|yiem naaiv maiv maaih maaic buonv sin nyei m sieqv dorn
Genesis_38_86_306480_311240.wav|hilaa ziouc nzuonx mingh mbuox yu ndaa
Genesis_38_87_311240_314920.wav|yie lorz maiv buatc wuov dauh m sieqv dorn
Genesis_38_88_314920_320360.wav|yiem wuov nyei mienh yaac gorngv yiem naaic maiv maaih jiex maaic buonv sin nyei m sieqv dorn
Genesis_38_89_320360_322280.wav|yu ndaa gorngv
Genesis_38_90_322280_325560.wav|wuov deix ga naaiv cinh ninh longc aqv
Genesis_38_91_325560_328040.wav|nziex mienh oix jatv mbuo mv bei
Genesis_38_92_328040_333280.wav|dorh yungh dorn mingh oix bun yaac lorz maiv buatc ninh bun
Genesis_38_93_333280_337880.wav|nqa haav aav lamh deix buo hlaax nyieqc nyei dorngx
Genesis_38_94_337880_341000.wav|maaih mienh mbuox yu ndaa
Genesis_38_95_341000_345520.wav|meih nyei mbuangz taamaa hienx nqox ih zanc toi gu nguaaz aqv
Genesis_38_96_345520_347080.wav|yu ndaa gorngv
Genesis_38_97_347080_349600.wav|dorh ninh cuotv daaih buov guangc maah
Genesis_38_98_349600_353320.wav|dorh taamaa cuotv daaih wuov zanc
Genesis_38_99_353320_357800.wav|taamaa juix waac mingh mbuox ninh nyei ong buoc
Genesis_38_100_357800_361600.wav|hienx yie toi gu nguaaz se dongh naaiv deix ga naaiv nyei ziouv
Genesis_38_101_361600_364200.wav|longx longx nyei mangc gaax
Genesis_38_102_364200_365600.wav|naaiv norm yienx
Genesis_38_103_365600_370040.wav|hlaang caux biaav mbiaac se haaix dauh nyei
Genesis_38_104_370040_373960.wav|yu ndaa zieqv duqv naaiv deix ga naaiv se ninh nyei
Genesis_38_105_373960_375200.wav|ninh gorngv
Genesis_38_106_375200_379720.wav|naaiv dauh m sieqv dorn zoux nyei se gauh horpc yie zoux nyei
Genesis_38_107_379720_384360.wav|weic zuqc yie maiv bun ninh longc yie nyei dorn qelaa
Genesis_38_108_384360_387760.wav|nqa haav yu ndaa yietc liuz maiv caux ninh bueix
Genesis_38_109_387760_392520.wav|taux yungz nyei ziangh hoc buatc taamaa maaih sung gu nguaaz
Genesis_38_110_392520_394680.wav|mun jienv wuov zanc
Genesis_38_111_394680_396600.wav|maaih dauh nyei buoz cuotv ndaangc
Genesis_38_112_396600_405520.wav|goux taamaa wuov dauh m sieqv dorn zorqv diuh fei siqv ndoh jienv gu nguaaz nyei buoz sei jaang aengx gorngv
Genesis_38_113_405520_408640.wav|naaiv dauh cuotv seix ndaangc
Genesis_38_114_408640_412240.wav|mv baac gu nguaaz aengx hluotv ninh nyei buoz bieqc
Genesis_38_115_412240_415960.wav|da nyeic dauh ziouc yungz cuotv ndaangc
Genesis_38_116_415960_418360.wav|goux taamaa wuov dauh m sieqv dorn gorngv
Genesis_38_117_418360_422400.wav|zoux haaix nyungc meih mbengx cuotv ndaangc laeh
Genesis_38_118_422400_426040.wav|wuov dauh dorn ninh mbuo ziouc cuotv mbuox heuc beletv
Genesis_38_119_426040_432560.wav|ndoh jienv fei siqv wuov dauh dorn nqa haav yungz yaac cuotv mbuox heuc zelaa
Genesis_39_1_8000_16200.wav|i saa maa en mienh dorh yosepv mingh i yipv deic bung maaic bun dauh i yipv mienh
Genesis_39_2_16200_19880.wav|se faalo hungh nyei domh jien
Genesis_39_3_19880_23600.wav|dongh goux hungh dinc nyei domh baeng bieiv
Genesis_39_4_23600_25720.wav|bo ti faa
Genesis_39_5_25720_30680.wav|ninh yiem ninh nyei i yipv mienh biauv ziouv nyei biauv
Genesis_39_6_30680_33000.wav|ziouv caux yosepv yiem
Genesis_39_7_33000_34720.wav|bun ninh duqv longx
Genesis_39_8_34720_39000.wav|wuov dauh biauv ziouv buatc ziouv caux yosepv yiem
Genesis_39_9_39000_45000.wav|ziouv yaac bun yosepv yiem ninh zoux nyei nyungc nyungc duqv longx
Genesis_39_10_45000_52400.wav|yosepv zoux duqv horpc bo ti faa nyei hnyouv yaac duqv zoux ninh nyei lengc jeiv bou
Genesis_39_11_52400_59120.wav|bo ti faa ziouc bun ninh goux biauv zong caux jaa dingh yietc zungv ga naaiv
Genesis_39_12_59120_66120.wav|yiem bo ti faa paaiv yosepv goux jienv ninh nyei biauv zong yietc zungv jaa dingh
Genesis_39_13_66120_72040.wav|ziouv weic yosepv ceix fuqv bun wuov dauh i yipv mienh nyei jaa dingh
Genesis_39_14_72040_78320.wav|da faanh yiem biauv yiem ndeic nyei yietc zungv ziouc camv jienv faaux
Genesis_39_15_78320_85160.wav|bo ti faa nyei yietc norm jaa dingh nyungc nyungc ga naaiv ninh jiu bun yosepv goux nzengc
Genesis_39_16_85160_88920.wav|cuotv liuz ninh ganh nyei nyanc hopv
Genesis_39_17_88920_91920.wav|ninh maiv zuqc nzauh haaix nyungc
Genesis_39_18_91920_95920.wav|yosepv nyei sin pei ziangh duqv longx
Genesis_39_19_95920_98680.wav|hmien mueic yaac nzueic
Genesis_39_20_98680_100280.wav|yiem gau
Genesis_39_30_137400_141360.wav|yie fungc haih zoux waaic sic ndongc naaic hlo
Genesis_39_31_141360_144360.wav|baamz zuiz dorngc tin hungh
Genesis_39_32_144360_148360.wav|maiv gunv wuov dauh auv hnoi hnoi yuoqc yosepv
Genesis_39_33_148360_152440.wav|yosepv maiv kangv caux ninh bueix
Genesis_39_34_152440_156360.wav|liemh maiv caux ninh yiem yietc norm dorngx
Genesis_39_35_156360_157840.wav|maaih hnoi nor
Genesis_39_36_157840_162560.wav|yosepv bieqc biauv zoux ninh horpc zuqc zoux nyei gong
Genesis_39_37_162560_165360.wav|yaac maiv maaih yietc dauh biauv nyei bou yiem wuov
Genesis_39_38_165360_171760.wav|bo ti faa nyei auv nyau jienv yosepv nyei lui gorngv
Genesis_39_39_171760_173840.wav|daaih caux yie bueix maah
Genesis_39_40_173840_179800.wav|mv baac yosepv guangc jienv ninh nyei lui yiem wuov dauh auv nyei buoz
Genesis_39_41_179800_183600.wav|biaux cuotv ga nyiec ziqc biauv mingh
Genesis_39_42_183600_189520.wav|wuov dauh auv buatc yosepv guangc jienv ninh nyei lui biaux cuotv ga nyiec
Genesis_39_43_189520_196240.wav|ninh ziouc nauc nauc nyei heuc yiem ninh nyei biauv wuov deix m jangc bou daaih
Genesis_39_44_196240_197200.wav|ninh gorngv
Genesis_39_45_197200_199360.wav|mangc gaax naaic
Genesis_39_46_199360_202520.wav|yie nyei nqox dorh naaiv dauh hipv lu mienh daaih
Genesis_39_47_202520_205200.wav|ih zanc ninh mangc piex yie mbuo
Genesis_39_48_205200_208400.wav|ninh bieqc daaih oix yie caux ninh bueix
Genesis_39_49_208400_210560.wav|mv baac yie qaqv nauc
Genesis_39_50_210560_212600.wav|ninh haiz yie heuc
Genesis_39_51_212600_219440.wav|ninh ziouc guangc jienv ninh nyei lui yiem yie naaiv aengx biaux cuotv biauv mi aqv
Genesis_39_52_219440_227720.wav|wuov dauh auv zorqv yosepv nyei lui an jienv ninh nyei ga hlen zuov yosepv nyei ziouv nzuonx daaih
Genesis_39_53_227720_231040.wav|ninh ziouc hnangv naaiv nor gorngv
Genesis_39_54_231040_240000.wav|dongh meih dorh daaih mbuo naaiv wuov dauh hipv lu nouh gauv bieqc daaih mangc yie maiv jiez oix caux yie
Genesis_39_55_240000_241560.wav|yie qaqv heuc
Genesis_39_56_241560_247800.wav|ninh ziouc guangc ninh nyei lui yiem yie naaiv biaux cuotv gaengh ka ndau mi aqv
Genesis_39_57_247800_253200.wav|yosepv nyei ziouv haiz ninh nyei auv gorngv
Genesis_39_58_253200_255640.wav|meih nyei nouh hnangv naaiv nor zoux bun yie
Genesis_39_59_255640_257720.wav|ninh ziouc qiex jiez haic
Genesis_39_60_257720_261240.wav|zorqv yosepv wuonx jienv loh
Genesis_39_61_261240_266400.wav|dongh wuonx hungh diex nyei zuiz mienh wuov norm loh
Genesis_39_62_266400_268960.wav|yosepv zuqc wuonx jienv wuov
Genesis_39_63_268960_271640.wav|mv baac tin hungh caux ninh yiem
Genesis_39_64_271640_273960.wav|yaac zoux longx bun ninh
Genesis_39_65_273960_280360.wav|bun ninh zoux duqv horpc goux loh wuov dauh jien nyei hnyouv
Genesis_39_66_280360_285520.wav|goux loh jien ziouc bun yosepv goux yietc zungv yiem loh nyei zuiz mienh
Genesis_39_67_285520_289400.wav|da faanh yiem loh gu nyuoz nyei sic
Genesis_39_68_289400_292240.wav|yosepv ganh gunv nzengc
Genesis_39_69_292240_295480.wav|yosepv goux jienv nyei yietc zungv sic
Genesis_39_70_295480_302360.wav|goux loh jien maiv zuqc nzauh weic zuqc ziouv caux yosepv yiem
Genesis_39_71_302360_307160.wav|ninh zoux nyei nyungc nyungc ziouv  tengx ninh zoux duqv longx
Genesis_3_10_51280_55000.wav|meih mbuo zungv zuqc daic aqv
Genesis_3_11_55000_57800.wav|naang gorngv mbuox m sieqv dorn
Genesis_3_12_57800_59000.wav|meih mbuo maiv daic lorqc
Genesis_3_13_59000_65960.wav|tin hungh hnangv naaiv gorngv weic zuqc ninh hiuv duqv meih mbuo nyanc liuz
Genesis_3_14_65960_69960.wav|meih mbuo haih hnamv duqv tong
Genesis_3_15_69960_73320.wav|meih mbuo ziouc hnangv tin hungh nor
Genesis_3_16_73320_77560.wav|haih hiuv duqv longx hiuv duqv ciouv
Genesis_3_17_77560_83000.wav|wuov dauh m sieqv dorn mangc buatc wuov zungh biouv nzueic nyei
Genesis_3_18_83000_86360.wav|daaix nyanc kuv nyei
Genesis_3_19_86360_91720.wav|ninh yaac hnamv daaih se gorngv haih bun mienh guai nor
Genesis_3_20_91720_94440.wav|za gengh longx haic
Genesis_3_21_94440_97560.wav|ninh ziouc gaeqv daaih nyanc aqv
Genesis_3_22_97560_101360.wav|aengx bun deix ninh nyei nqox nyanc
Genesis_3_23_101360_104280.wav|ninh mbuo nyanc liuz
Genesis_3_24_104280_107280.wav|ninh mbuo haih hnamv duqv tong
Genesis_3_25_107280_111120.wav|ninh mbuo hiuv duqv ganh laengh gaengv nyei yiem
Genesis_3_26_111120_116520.wav|ziouc zorqv ngongh nyorx ndiangx normh lunh daaih pongx jienv aqv
Genesis_3_27_116520_118600.wav|wuov hnoi
Genesis_3_28_118600_121960.wav|lungh maanz hmuangx nyei ziangh hoc
Genesis_3_29_121960_128440.wav|ninh mbuo haiz ziouv tin hungh yiem huingx gu nyuoz yangh jauv
Genesis_3_30_128440_136080.wav|wuov dauh m jangc dorn caux ninh nyei auv ziouc bieqc huingx nyei ndiangx lomc mingh bingx jienv ziouv
Genesis_3_31_136080_140040.wav|mv baac ziouv  tin hungh heuc wuov dauh m jangc dorn
Genesis_3_32_140040_142480.wav|meih yiem haaix laeh
Genesis_3_33_142480_146520.wav|wuov dauh m jangc dorn dau
Genesis_3_34_146520_150560.wav|yie haiz meih yiem naaiv huingx
Genesis_3_35_150560_155760.wav|yie gamh nziex haic weic zuqc yie laengh gaengv nyei yiem ziouc bingx meih
Genesis_3_36_155760_159280.wav|tin hungh naaic gaax
Genesis_3_37_159280_161720.wav|haaix dauh mbuox meih
Genesis_3_38_161720_166440.wav|meih nyei sin laengh gaengv nyei
Genesis_3_39_166440_173160.wav|meih nyanc dongh yie hatc meih maiv dungx nyanc wuov zungh biouv mi aqv saah
Genesis_3_40_173160_176240.wav|wuov dauh m jangc dorn dau
Genesis_3_41_176240_182480.wav|dongh meih bun daaih caux yie yiem naaiv wuov dauh m sieqv dorn
Genesis_3_42_182480_186160.wav|ninh bun naaiv zungh ndiangx nyei biouv yie
Genesis_3_43_186160_189480.wav|yie ziouc nyanc mi aqv
Genesis_3_44_189480_193480.wav|ziouv  tin hungh naaic gaax wuov dauh m sieqv dorn
Genesis_3_45_193480_196600.wav|meih zoux cuotv haaix nyungc sic mi aqv
Genesis_3_46_196600_200000.wav|wuov dauh m sieqv dorn dau
Genesis_3_47_200000_202320.wav|naang ganh nduov yie
Genesis_3_48_202320_203040.wav|yie ziouc nyanc
Genesis_3_49_203040_208160.wav|tin hungh dingc zuiz
Genesis_3_50_208160_211560.wav|ziouv tin hungh mbuox wuov diuh naang
Genesis_3_51_211560_214840.wav|laaix meih hnangv naaiv nor zoux
Genesis_3_52_214840_219800.wav|meih ziouc zuqc houv gauh hniev yietc zungv saeng kuv
Genesis_3_53_219800_223520.wav|gauh camv yietc zungv hieh zoih
Genesis_3_54_223520_228720.wav|meih oix zuqc longc ga sie luih jienv gan ndau mingh
Genesis_3_55_228720_231960.wav|yietc seix oix zuqc nyanc nie mbung
Genesis_3_56_231960_234600.wav|yie oix bun meih caux naaiv dauh m sieqv dorn daav win
Genesis_3_57_234600_242680.wav|yaac bun meih nyei zeiv fun caux ninh nyei zeiv fun zoux win wangv
Genesis_3_58_242680_246840.wav|ninh nyei zeiv fun oix mborqv meih nyei m nqorngv huv
Genesis_3_59_246840_249240.wav|meih yaac oix nyorqv ninh nyei zaux nqo
Genesis_3_60_249240_255760.wav|tin hungh yaac gorngv mbuox wuov dauh m sieqv dorn
Genesis_3_61_255760_260760.wav|maaih sin nyei ziangh hoc yie oix jaa tipv bun meih kouv
Genesis_3_62_260760_264720.wav|ndutv sin nyei ziangh hoc meih oix zuqc mun
Genesis_3_63_264720_268760.wav|mv baac meih corc oix longc meih nyei nqox
Genesis_3_64_268760_270800.wav|meih nyei nqox yaac oix gunv jienv meih
Genesis_3_65_270800_275520.wav|tin hungh yaac gorngv mbuox aa ndam
Genesis_3_66_275520_279280.wav|laaix meih muangx meih nyei auv nyei waac
Genesis_3_67_279280_282240.wav|nyanc dongh yie hatc meih
Genesis_3_68_282240_285520.wav|maiv dungx nyanc wuov zungh biouv
Genesis_3_69_285520_289360.wav|ndau ziouc laaix meih zoux nyei sic zuqc houv
Genesis_3_70_289360_292840.wav|meih yietc seix oix zuqc bangc ndau zoux gong kouv cingx duqv nyancGenesis_40_20_96200_97400.wav|yosepv dau
Genesis_40_21_97400_101680.wav|kungx tin hungh hnangv haih porv mbeix maiv zeiz
Genesis_40_22_101680_107120.wav|meih mbuo gorngv meih mbuo nyei mbeix bun yie muangx maah
Genesis_40_23_107120_112760.wav|bouh a ngunc diuv wuov dauh domh jien ziouc gorngv ninh nyei mbeix bun yosepv muangx
Genesis_40_24_112760_118960.wav|ninh gorngv yie buatc diuh a ngunc hmei yiem yie nyei nza hmien
Genesis_40_25_118960_123000.wav|wuov diuh hmei yaac maaih buo caax nquaah
Genesis_40_26_123000_127960.wav|yietv cuotv cunx daaih yaac nqoi biangh
Genesis_40_27_127960_130160.wav|biouv joih yaac zuoqc
Genesis_40_28_130160_135720.wav|wuov zanc faalo hungh nyei zaanv yiem yie nyei buoz
Genesis_40_29_135720_143600.wav|yie ziouc gaeqv wuov deix a ngunc biouv nanv biouv wuom dapv jienv zaanv bouh bun faalo
Genesis_40_30_143600_145120.wav|yosepv gorngv
Genesis_40_31_145120_148080.wav|meih nyei mbeix nyei eix leiz se hnangv naaiv
Genesis_40_32_148080_153440.wav|wuov deix buo nquaav nquaah beiv buo hnoi
Genesis_40_33_153440_158040.wav|aengx buo hnoi faalo hungh oix bungx meih cuotv
Genesis_40_34_158040_160920.wav|oix guangc meih nyei zuiz
Genesis_40_35_160920_164920.wav|yaac bun meih duqv zoux gong hnangv loz wuov nor
Genesis_40_36_164920_171640.wav|meih aengx duqv bouh a ngunc diuv bun faalo hungh hnangv zinh ndaangc meih zoux wuov nor
Genesis_40_37_171640_176080.wav|meih duqv longx nyei ziangh hoc tov jangx deix yie
Genesis_40_38_176080_178640.wav|zoux longx bun yie
Genesis_40_39_178640_183400.wav|gorngv deix yie nyei jauv bun faalo hungh muangx
Genesis_40_40_183400_185960.wav|njoux yie cuotv naaiv norm loh
Genesis_40_41_185960_191120.wav|yie yiem hipv lu mienh nyei deic bung zuqc dorh taux naaiv daaih
Genesis_40_42_191120_200000.wav|yiem naaiv i yipv deic bung yie yaac maiv dorngc haaix nyungc zic duqv bun yie zuqc wuonx jienv naaiv loh hmuangx
Genesis_40_43_200000_205280.wav|zoux njuov nyei domh jien buatc yosepv porv mbeix nyei eix leiz longx
Genesis_40_44_205280_207640.wav|ninh ziouc gorngv mbuox yosepv
Genesis_40_45_207640_210480.wav|yie yaac mbeix norm mbeix
Genesis_40_46_210480_215960.wav|yie buatc yie ganh nyei m nqorngv ndongx jienv buo norm jei
Genesis_40_47_215960_217760.wav|dapv jienv njuov nyei
Genesis_40_48_217760_224800.wav|gu nguaaic wuov norm jei maaih nyungc nyungc ziqv daaih nyei njuov bun faalo hungh nyanc
Genesis_40_49_224800_228680.wav|mv baac norqc daaih nyanc wuov deix njuov
Genesis_40_50_228680_230320.wav|yosepv gorngv
Genesis_40_51_230320_232960.wav|meih nyei mbeix nyei eix leiz se hnangv naaiv
Genesis_40_52_232960_236360.wav|wuov deix buo norm jei beiv buo hnoi
Genesis_40_53_236360_245080.wav|aengx buo hnoi faalo hungh oix bun mienh hngaqv ndutv meih nyei m nqorngv aengx zorqv meih nyei sei ndiux jienv ndiangx
Genesis_40_54_245080_248960.wav|norqc yaac oix daaih nyanc meih nyei orv
Genesis_40_55_248960_254200.wav|aengx jiex buo hnoi taux faalo hungh nyei sih nyietv hnoi
Genesis_40_56_254200_261320.wav|ninh ziouc mbenc nyanc hopv zoux jorm cingv ninh nyei yietc zungv zoux jien nyei mienh daaih
Genesis_40_57_261320_270000.wav|ninh yaac bungx bouh a ngunc diuv caux zoux njuov wuov deix i dauh domh jien cuotv daaih yiem zuangx jien nyei nza hmien
Genesis_40_58_270000_274800.wav|bouh a ngunc diuv wuov dauh aengx duqv zoux gong hnangv loz wuov nor
Genesis_40_59_274800_279240.wav|ziouc zorqv diuv zaanv bouh mingh bun hungh diex
Genesis_40_60_279240_281360.wav|mv baac zoux njuov wuov dauh aeqv
Genesis_40_61_281360_287000.wav|faalo hungh heuc zorqv daaih ndiux jienv wuov ndiangx daix guangc mi aqv
Genesis_40_62_287000_291160.wav|naaiv deix sic za gengh doix nzengc yosepv porv nyei mbeix
Genesis_40_63_291160_296200.wav|mv baac bouh a ngunc diuv wuov dauh jien la kuqv yosepv mi aqv
Genesis_40_64_296200_297680.wav|maiv jangx zuqc ninh aqv
Genesis_41_30_137440_141000.wav|yietc dauh nyei mbeix maaih yietc nyungc eix leiz
Genesis_41_31_141000_146800.wav|maaih dauh hipv lu mienh lunx mienh yaac caux yie mbuo zuqc wuonx jienv loh
Genesis_41_32_146800_151480.wav|ninh zoux goux hungh dinc nyei domh baeng bieiv nyei nouh
Genesis_41_33_151480_155480.wav|yie mbuo gorngv yie mbuo nyei mbeix bun ninh muangx
Genesis_41_34_155480_159720.wav|ninh ziouc ziux gorqv mienh nyei mbeix porv mbeix nyei eix leiz
Genesis_41_35_159720_164560.wav|nqa haav za gengh doix diuc nzengc ninh porv nyei eix leiz
Genesis_41_36_164560_167840.wav|yie duqv zoux gong hnangv zinh ndaangc nor
Genesis_41_37_167840_173880.wav|mv baac zoux njuov wuov dauh zuqc dorh mingh ndiux jienv ndiangx daix guangc
Genesis_41_38_173880_178520.wav|faalo hungh ziouc paaiv mienh mingh heuc yosepv daaih
Genesis_41_39_178520_182640.wav|ninh mbuo ziouc siepv siepv nyei mingh dorh ninh cuotv
Genesis_41_40_182640_185800.wav|yosepv teix siaam japv mba bieiv
Genesis_41_41_185800_187400.wav|yienc nqoi lui houx
Genesis_41_42_187400_190200.wav|mingh taux faalo hungh nyei nza hmien
Genesis_41_43_190200_192160.wav|hungh diex gorngv mbuox ninh
Genesis_41_44_192160_196200.wav|yie mbeix norm mbeix yaac maiv maaih haaix dauh haih porv duqv cuotv
Genesis_41_45_196200_201640.wav|yie haiz mienh gorngv meih haiz liuz mbeix ziouc haih porv mbeix nyei
Genesis_41_46_201640_205240.wav|yosepv dau faalo hungh
Genesis_41_47_205240_212320.wav|se maiv zeiz yie haih porv mbeix tin hungh ganh oix porv duqv horpc mbuox faalo
Genesis_41_48_212320_215480.wav|faalo hungh ziouc gorngv mbuox yosepv
Genesis_41_49_215480_220360.wav|yie mbeix buatc yie ganh souv jienv nai aa ndaaih hlen
Genesis_41_50_220360_223840.wav|maaih siec dauh yangh ngongh nyeiz nzueic nyei junc nyei
Genesis_41_51_223840_227480.wav|yiem wuov ndaaih cuotv daaih yiem wuov nyanc luoqc diqc normh
Genesis_41_52_227480_232800.wav|nqa haav aengx maaih siec dauh yangh ngongh nyeiz korng jaic nyei
Genesis_41_53_232800_235920.wav|aqc mangc nyei cuotv daaih
Genesis_41_54_235920_240120.wav|yiem i yipv deic bung yie maiv gaengh buatc jiex yangh ngongh ndongc naaic aqc mangc
Genesis_41_55_240120_245600.wav|wuov deix ngongh jaic nyanc nzengc cuotv ndaangc wuov deix siec dauh ngongh junc
Genesis_41_65_276480_286120.wav|yie gorngv yie nyei mbeix bun mangc sou porv mbeix nyei fin saeng muangx yaac maiv maaih yietc dauh haih porv duqv cuotv
Genesis_41_66_286120_289320.wav|yosepv ziouc gorngv mbuox faalo hungh
Genesis_41_67_289320_291880.wav|i norm mbeix nyei eix leiz zungv fih hnangv nyei
Genesis_41_68_291880_297440.wav|tin hungh jaa ndaangc bun meih hiuv duqv ninh oix hnangv haaix nor zoux
Genesis_41_69_297440_301400.wav|wuov deix siec dauh yangh ngongh junc beiv siec hnyangx
Genesis_41_70_301400_306680.wav|wuov deix siec dorv mbiauh jauh yaac beiv siec hnyangx
Genesis_41_71_306680_308720.wav|i norm mbeix nyei eix leiz se fih hnangv nyei
Genesis_41_72_308720_313320.wav|nqa haav cuotv wuov deix siec dauh yangh ngongh jaic nyei
Genesis_41_73_313320_314200.wav|aqc mangc nyei
Genesis_41_74_314200_320120.wav|caux wuov deix siec dorv mbiauh maux zuqc dong bung maengx nyei nziaaux buonc jieqv mingh
Genesis_41_75_320120_324960.wav|se beiv siec hnyangx domh huaang domh ngorc
Genesis_41_76_324960_328920.wav|naaiv za gengh hnangv yie mbuox liuz hungh diex wuov nor
Genesis_41_77_328920_333800.wav|tin hungh oix bun meih hiuv duqv ninh oix hnangv haaix nor zoux
Genesis_41_78_333800_336560.wav|yiem naaiv mingh siec hnyangx gu nyuoz
Genesis_41_79_336560_340560.wav|gormx i yipv deic bung bungx zuoqc longx
Genesis_41_80_340560_345240.wav|nqa haav aengx maaih siec hnyangx domh huaang domh ngorc
Genesis_41_90_382720_386760.wav|aengx orn deix jien gunv gormx deic bung
Genesis_41_91_386760_395320.wav|naaiv deix bungx zuoqc longx nyei siec hnyangx gu nyuoz oix zuqc siou yietc zungv gaeng zuangx biaa gouv nyei yietc gouv
Genesis_41_92_395320_409200.wav|naaiv deix hnyangx zingh longx nyei ziangh hoc naaiv deix jien oix zuqc zorqv laangh ziqc gapv nzoih guei faalo hungh nyei buoz ndiev siou jienv yiem norm norm zingh zoux nyanc hopv
Genesis_41_93_409200_422400.wav|naaiv deix laangh ziqc liouh jienv mbungh i yipv deic bung ngorc siec hnyangx nyei ziangh hoc ziouc maaih nyanc maaih hopv weic maiv bun deic bung laaix ngorc hnaangx zuqc mietc nzengc
Genesis_41_94_422400_426200.wav|faalo liepc yosepv zoux i yipv deic bung nyei zungx
Genesis_41_95_426200_433600.wav|faalo hungh caux ninh nyei yietc zungv jien haiz yosepv nyei za eix longx nyei
Genesis_41_96_433600_436960.wav|hungh diex gorngv mbuox ninh nyei zuangx jien
Genesis_41_97_436960_441560.wav|mbuo haih lorz duqv ganh dauh hnangv naaiv dauh maaih tin hungh nyei singx lingh fai
Genesis_41_98_441560_444440.wav|ninh gorngv mbuox yosepv
Genesis_41_99_444440_448400.wav|weic zuqc tin hungh bun meih hiuv duqv naaiv deix yietc zungv sic
Genesis_41_100_448400_451960.wav|maiv maaih haaix dauh ndongc meih guai yaac maaih cong mengh
Genesis_41_101_451960_456120.wav|yie oix bun meih goux yie nyei dinc
Genesis_41_102_456120_460160.wav|yie nyei zuangx baeqc fingx yaac oix zuqc mbuoqc meih
Genesis_41_103_460160_461360.wav|muangx meih nyei waac
Genesis_41_104_461360_465520.wav|kungx yie ganh maaih lingc gauh hlo jiex meih nyei hnangv
Genesis_41_105_465520_469320.wav|yosepv gunv nzengc i yipv deic bung
Genesis_41_106_469320_472800.wav|faalo hungh aengx gorngv mbuox yosepv
Genesis_41_107_472800_477120.wav|yie ih zanc orn meih gunv nzengc i yipv deic bung
Genesis_41_108_477120_483000.wav|faalo hungh ziouc hlutv maaih yienx nyei buoz ndoqv nzaeng tengx yosepv dangh jienv
Genesis_41_109_483000_488280.wav|bun ninh zuqv jienv la maah ndie muonc nyei lui ndaauv
Genesis_41_110_488280_492520.wav|aengx zorqv diuh jiem limc kuangx jienv ninh nyei jaang
Genesis_41_111_492520_498480.wav|faalo yaac bun yosepv zueiz ninh nyei da nyeic norm maaz cie
Genesis_41_112_498480_501280.wav|aengx maaih mienh mingh ndaangc heuc jienv gorngv
Genesis_41_113_501280_504560.wav|gueic njiec ov
Genesis_41_114_504560_510040.wav|faalo hungh hnangv naaiv orn ninh gunv i yipv deic bung
Genesis_41_115_510040_512000.wav|faalo aengx gorngv mbuox yosepv
Genesis_41_116_512000_514440.wav|yie zoux faalo hungh diex
Genesis_41_117_514440_516400.wav|cuotv liuz meih ganh nqoi nzuih
Genesis_41_118_516400_520840.wav|yiem naaiv i yipv deic bung maiv maaih haaix dauh haih zoux haaix nyungc
